"No.","Time","Source","Destination","Protocol","Length","Info","New Column"
"6928","-62.509434","127.0.0.1","127.0.0.1","TCP","68","60471 > 59640 [SYN, ECN, CWR] Seq=0 Win=65535 Len=0 MSS=16344 WS=32 TSval=1361430549 TSecr=0 SACK_PERM=1",""
"6929","-62.509321","127.0.0.1","127.0.0.1","TCP","68","59640 > 60471 [SYN, ACK] Seq=0 Ack=1 Win=65535 Len=0 MSS=16344 WS=32 TSval=1361430549 TSecr=1361430549 SACK_PERM=1",""
"6930","-62.509296","127.0.0.1","127.0.0.1","TCP","56","60471 > 59640 [ACK] Seq=1 Ack=1 Win=408288 Len=0 TSval=1361430549 TSecr=1361430549",""
"6931","-62.509279","127.0.0.1","127.0.0.1","TCP","56","[TCP Window Update] 59640 > 60471 [ACK] Seq=1 Ack=1 Win=408288 Len=0 TSval=1361430549 TSecr=1361430549",""
"6932","-62.506977","127.0.0.1","127.0.0.1","TCP","71","59640 > 60471 [PSH, ACK] Seq=1 Ack=1 Win=408288 Len=15 TSval=1361430551 TSecr=1361430549","Type: connect\\r\\n"
"6933","-62.506950","127.0.0.1","127.0.0.1","TCP","56","60471 > 59640 [ACK] Seq=1 Ack=16 Win=408256 Len=0 TSval=1361430551 TSecr=1361430551",""
"6934","-62.506283","127.0.0.1","127.0.0.1","TCP","147","59640 > 60471 [PSH, ACK] Seq=16 Ack=1 Win=408288 Len=91 TSval=1361430551 TSecr=1361430551","V8-Version: 3.9.24.29\\r\\nProtocol-Version: 1\\r\\nEmbedding-Host: titanium\\r\\nContent-Length: 0\\r\\n\\r\\n"
"6935","-62.506252","127.0.0.1","127.0.0.1","TCP","56","60471 > 59640 [ACK] Seq=1 Ack=107 Win=408192 Len=0 TSval=1361430551 TSecr=1361430551",""
"6944","-62.471074","127.0.0.1","127.0.0.1","TCP","70","60471 > 59640 [PSH, ACK] Seq=1 Ack=107 Win=408192 Len=14 TSval=1361430584 TSecr=1361430551","Content-Length"
"6945","-62.471039","127.0.0.1","127.0.0.1","TCP","56","59640 > 60471 [ACK] Seq=107 Ack=15 Win=408256 Len=0 TSval=1361430584 TSecr=1361430584",""
"6946","-62.471023","127.0.0.1","127.0.0.1","TCP","109","60471 > 59640 [PSH, ACK] Seq=15 Ack=107 Win=408192 Len=53 TSval=1361430584 TSecr=1361430584",":46\\r\\n\\r\\n{""seq"":1,""type"":""request"",""command"":""version""}"
"6947","-62.471015","127.0.0.1","127.0.0.1","TCP","56","59640 > 60471 [ACK] Seq=107 Ack=68 Win=408224 Len=0 TSval=1361430584 TSecr=1361430584",""
"6952","-62.351105","127.0.0.1","127.0.0.1","TCP","77","59640 > 60471 [PSH, ACK] Seq=107 Ack=68 Win=408224 Len=21 TSval=1361430685 TSecr=1361430584","Content-Length: 712\\r\\n"
"6953","-62.351079","127.0.0.1","127.0.0.1","TCP","56","60471 > 59640 [ACK] Seq=68 Ack=128 Win=408160 Len=0 TSval=1361430685 TSecr=1361430685",""
"6954","-62.312370","127.0.0.1","127.0.0.1","TCP","930","59640 > 60471 [PSH, ACK] Seq=128 Ack=68 Win=408224 Len=874 TSval=1361430718 TSecr=1361430685","\\r\\n{""seq"":0,""type"":""event"",""event"":""break"",""body"":{""invocationText"":""function Module(id, parent, context) {\\n\\tthis.id = id;\\n\\tthis.exports = {};\\n\\tthis.parent = parent;\\n\\tthis.context = context;\\n\\n\\tthis.filename = null;\\n\\tthis.loaded = false;\\n\\tt"
"6955","-62.312345","127.0.0.1","127.0.0.1","TCP","56","60471 > 59640 [ACK] Seq=68 Ack=1002 Win=407296 Len=0 TSval=1361430718 TSecr=1361430718",""
"6988","-62.224907","127.0.0.1","127.0.0.1","TCP","70","60471 > 59640 [PSH, ACK] Seq=68 Ack=1002 Win=407296 Len=14 TSval=1361430788 TSecr=1361430718","Content-Length"
"6989","-62.224882","127.0.0.1","127.0.0.1","TCP","56","59640 > 60471 [ACK] Seq=1002 Ack=82 Win=408192 Len=0 TSval=1361430788 TSecr=1361430788",""
"6990","-62.224869","127.0.0.1","127.0.0.1","TCP","63","60471 > 59640 [PSH, ACK] Seq=82 Ack=1002 Win=407296 Len=7 TSval=1361430788 TSecr=1361430788",":80\\r\\n\\r\\n"
"6991","-62.224853","127.0.0.1","127.0.0.1","TCP","56","59640 > 60471 [ACK] Seq=1002 Ack=89 Win=408192 Len=0 TSval=1361430788 TSecr=1361430788",""
"6992","-62.224843","127.0.0.1","127.0.0.1","TCP","136","60471 > 59640 [PSH, ACK] Seq=89 Ack=1002 Win=407296 Len=80 TSval=1361430788 TSecr=1361430788","{""seq"":2,""type"":""request"",""command"":""backtrace"",""arguments"":{""inlineRefs"":true}}"
"6993","-62.224835","127.0.0.1","127.0.0.1","TCP","56","59640 > 60471 [ACK] Seq=1002 Ack=169 Win=408128 Len=0 TSval=1361430788 TSecr=1361430788",""
"6994","-62.213776","127.0.0.1","127.0.0.1","TCP","78","59640 > 60471 [PSH, ACK] Seq=1002 Ack=169 Win=408128 Len=22 TSval=1361430798 TSecr=1361430788","Content-Length: 1981\\r\\n"
"6995","-62.213752","127.0.0.1","127.0.0.1","TCP","56","60471 > 59640 [ACK] Seq=169 Ack=1024 Win=407264 Len=0 TSval=1361430798 TSecr=1361430798",""
"6996","-62.213611","127.0.0.1","127.0.0.1","TCP","70","60471 > 59640 [PSH, ACK] Seq=169 Ack=1024 Win=407264 Len=14 TSval=1361430798 TSecr=1361430798","Content-Length"
"6997","-62.213592","127.0.0.1","127.0.0.1","TCP","56","59640 > 60471 [ACK] Seq=1024 Ack=183 Win=408096 Len=0 TSval=1361430798 TSecr=1361430798",""
"6998","-62.213583","127.0.0.1","127.0.0.1","TCP","60","60471 > 59640 [PSH, ACK] Seq=183 Ack=1024 Win=407264 Len=4 TSval=1361430798 TSecr=1361430798",":136"
"6999","-62.213574","127.0.0.1","127.0.0.1","TCP","56","59640 > 60471 [ACK] Seq=1024 Ack=187 Win=408096 Len=0 TSval=1361430798 TSecr=1361430798",""
"7000","-62.213564","127.0.0.1","127.0.0.1","TCP","196","60471 > 59640 [PSH, ACK] Seq=187 Ack=1024 Win=407264 Len=140 TSval=1361430798 TSecr=1361430798","\\r\\n\\r\\n{""seq"":3,""type"":""request"",""command"":""setbreakpoint"",""arguments"":{""line"":37,""column"":0,""type"":""script"",""enabled"":true,""target"":""app.js""}}"
"7001","-62.213559","127.0.0.1","127.0.0.1","TCP","56","59640 > 60471 [ACK] Seq=1024 Ack=327 Win=407968 Len=0 TSval=1361430798 TSecr=1361430798",""
"7002","-62.213179","127.0.0.1","127.0.0.1","TCP","70","60471 > 59640 [PSH, ACK] Seq=327 Ack=1024 Win=407264 Len=14 TSval=1361430798 TSecr=1361430798","Content-Length"
"7003","-62.213152","127.0.0.1","127.0.0.1","TCP","56","59640 > 60471 [ACK] Seq=1024 Ack=341 Win=407936 Len=0 TSval=1361430798 TSecr=1361430798",""
"7004","-62.213137","127.0.0.1","127.0.0.1","TCP","200","60471 > 59640 [PSH, ACK] Seq=341 Ack=1024 Win=407264 Len=144 TSval=1361430798 TSecr=1361430798",":136\\r\\n\\r\\n{""seq"":4,""type"":""request"",""command"":""setbreakpoint"",""arguments"":{""line"":43,""column"":0,""type"":""script"",""enabled"":true,""target"":""app.js""}}"
"7005","-62.213125","127.0.0.1","127.0.0.1","TCP","56","59640 > 60471 [ACK] Seq=1024 Ack=485 Win=407808 Len=0 TSval=1361430798 TSecr=1361430798",""
"7006","-62.212965","127.0.0.1","127.0.0.1","TCP","70","60471 > 59640 [PSH, ACK] Seq=485 Ack=1024 Win=407264 Len=14 TSval=1361430798 TSecr=1361430798","Content-Length"
"7007","-62.212943","127.0.0.1","127.0.0.1","TCP","56","59640 > 60471 [ACK] Seq=1024 Ack=499 Win=407776 Len=0 TSval=1361430798 TSecr=1361430798",""
"7008","-62.212932","127.0.0.1","127.0.0.1","TCP","62","60471 > 59640 [PSH, ACK] Seq=499 Ack=1024 Win=407264 Len=6 TSval=1361430798 TSecr=1361430798",":136\\r\\n"
"7009","-62.212924","127.0.0.1","127.0.0.1","TCP","56","59640 > 60471 [ACK] Seq=1024 Ack=505 Win=407776 Len=0 TSval=1361430798 TSecr=1361430798",""
"7010","-62.212916","127.0.0.1","127.0.0.1","TCP","58","60471 > 59640 [PSH, ACK] Seq=505 Ack=1024 Win=407264 Len=2 TSval=1361430798 TSecr=1361430798","\\r\\n"
"7011","-62.212909","127.0.0.1","127.0.0.1","TCP","56","59640 > 60471 [ACK] Seq=1024 Ack=507 Win=407776 Len=0 TSval=1361430798 TSecr=1361430798",""
"7012","-62.212732","127.0.0.1","127.0.0.1","TCP","192","60471 > 59640 [PSH, ACK] Seq=507 Ack=1024 Win=407264 Len=136 TSval=1361430799 TSecr=1361430798","{""seq"":5,""type"":""request"",""command"":""setbreakpoint"",""arguments"":{""line"":33,""column"":0,""type"":""script"",""enabled"":true,""target"":""app.js""}}"
"7013","-62.212714","127.0.0.1","127.0.0.1","TCP","56","59640 > 60471 [ACK] Seq=1024 Ack=643 Win=407648 Len=0 TSval=1361430799 TSecr=1361430799",""
"7014","-62.212609","127.0.0.1","127.0.0.1","TCP","448","59640 > 60471 [PSH, ACK] Seq=1024 Ack=643 Win=407648 Len=392 TSval=1361430799 TSecr=1361430799","\\r\\n{""seq"":2,""request_seq"":2,""type"":""response"",""command"":""backtrace"",""success"":true,""body"":{""fromFrame"":0,""toFrame"":1,""totalFrames"":1,""frames"":[{""type"":""frame"",""index"":0,""receiver"":{""ref"":1,""type"":""function"",""name"":""Module"",""inferredName"":"""",""scriptId"":31"
"7015","-62.212581","127.0.0.1","127.0.0.1","TCP","56","60471 > 59640 [ACK] Seq=643 Ack=1416 Win=406880 Len=0 TSval=1361430799 TSecr=1361430799",""
"7016","-62.211049","127.0.0.1","127.0.0.1","TCP","1647","59640 > 60471 [PSH, ACK] Seq=1416 Ack=643 Win=407648 Len=1591 TSval=1361430800 TSecr=1361430799","Return"":false,""debuggerFrame"":false,""arguments"":[{""name"":""source"",""value"":{""ref"":4,""type"":""string"",""value"":""// this sets the background color of the master UIView (when there are no window... (length: 1167)""}},{""name"":""filename"",""value"":{""ref"":5,""type"":""s"
"7017","-62.211023","127.0.0.1","127.0.0.1","TCP","56","60471 > 59640 [ACK] Seq=643 Ack=3007 Win=405280 Len=0 TSval=1361430800 TSecr=1361430800",""
"7018","-62.192813","127.0.0.1","127.0.0.1","TCP","70","60471 > 59640 [PSH, ACK] Seq=643 Ack=3007 Win=405280 Len=14 TSval=1361430815 TSecr=1361430800","Content-Length"
"7019","-62.192788","127.0.0.1","127.0.0.1","TCP","56","59640 > 60471 [ACK] Seq=3007 Ack=657 Win=407616 Len=0 TSval=1361430815 TSecr=1361430815",""
"7020","-62.192778","127.0.0.1","127.0.0.1","TCP","63","60471 > 59640 [PSH, ACK] Seq=657 Ack=3007 Win=405280 Len=7 TSval=1361430815 TSecr=1361430815",":91\\r\\n\\r\\n"
"7021","-62.192769","127.0.0.1","127.0.0.1","TCP","56","59640 > 60471 [ACK] Seq=3007 Ack=664 Win=407616 Len=0 TSval=1361430815 TSecr=1361430815",""
"7022","-62.192761","127.0.0.1","127.0.0.1","TCP","147","60471 > 59640 [PSH, ACK] Seq=664 Ack=3007 Win=405280 Len=91 TSval=1361430815 TSecr=1361430815","{""seq"":7,""type"":""request"",""command"":""scripts"",""arguments"":{""types"":4,""includeSource"":true}}"
"7023","-62.192750","127.0.0.1","127.0.0.1","TCP","56","59640 > 60471 [ACK] Seq=3007 Ack=755 Win=407520 Len=0 TSval=1361430815 TSecr=1361430815",""
"7024","-62.178213","127.0.0.1","127.0.0.1","TCP","77","59640 > 60471 [PSH, ACK] Seq=3007 Ack=755 Win=407520 Len=21 TSval=1361430826 TSecr=1361430815","Content-Length: 220\\r\\n"
"7025","-62.178193","127.0.0.1","127.0.0.1","TCP","56","60471 > 59640 [ACK] Seq=755 Ack=3028 Win=405248 Len=0 TSval=1361430826 TSecr=1361430826",""
"7026","-62.139097","127.0.0.1","127.0.0.1","TCP","16388","59640 > 60471 [ACK] Seq=3028 Ack=755 Win=407520 Len=16332 TSval=1361430857 TSecr=1361430826","\\r\\n{""seq"":3,""request_seq"":3,""type"":""response"",""command"":""setbreakpoint"",""success"":true,""body"":{""type"":""scriptName"",""breakpoint"":1,""script_name"":""app.js"",""line"":37,""column"":0,""actual_locations"":[]},""refs"":[],""running"":false}Content-Length: 220\\r\\n\\r\\n{""se"
"7027","-62.139090","127.0.0.1","127.0.0.1","TCP","16388","59640 > 60471 [ACK] Seq=19360 Ack=755 Win=407520 Len=16332 TSval=1361430857 TSecr=1361430826","ficationManager\\"", \\""Android.NotificationManager\\"");\\n\\t\\t\\t\\t\\t\\t\\t},\\n\\t\\t\\t\\t\\t\\t\\tconfigurable: true\\n\\t\\t\\t\\t\\t\\t},\\n\\t\\t\\t\\t\\t\\t\\""TiActivityWindow\\"": {\\n\\t\\t\\t\\t\\t\\t\\tget: function() {\\n\\t\\t\\t\\t\\t\\t\\t\\treturn lazyGet(this, \\""org.appcelerator.titaniu"
"7028","-62.139081","127.0.0.1","127.0.0.1","TCP","16388","59640 > 60471 [ACK] Seq=35692 Ack=755 Win=407520 Len=16332 TSval=1361430857 TSecr=1361430826","\\t\\t\\t\\t\\tvar Filesystem = lazyGet(this, \\""ti.modules.titanium.filesystem.FilesystemModule\\"", \\""Filesystem\\"", \\""Filesystem\\"");\\n\\t\\t\\t\\t\\tif (!(\\""__propertiesDefined__\\"" in Filesystem)) {\\t\\t\\n\\t\\t\\t\\t\\tObject.defineProperties(Filesystem, {\\n\\t\\t\\t\\t\\t\\t\\"
"7029","-62.139078","127.0.0.1","127.0.0.1","TCP","16388","59640 > 60471 [ACK] Seq=52024 Ack=755 Win=407520 Len=16332 TSval=1361430857 TSecr=1361430826","t\\t\\t\\t\\t\\t},\\n\\t\\t\\t\\t\\t\\t\\""ActivityIndicatorStyle\\"": {\\n\\t\\t\\t\\t\\t\\t\\tget: function() {\\n\\t\\t\\t\\t\\t\\t\\t\\treturn lazyGet(this, \\""ti.modules.titanium.ui.activityindicatorstyle.ActivityIndicatorStyleModule\\"", \\""ActivityIndicatorStyle\\"", \\""UI.ActivityIndica"
"7030","-62.139075","127.0.0.1","127.0.0.1","TCP","196","59640 > 60471 [PSH, ACK] Seq=68356 Ack=755 Win=407520 Len=140 TSval=1361430857 TSecr=1361430826","var apiNamespace = wrapperAPI;\\n\\n\\tfor (var j = 0, namesLen = length; j < namesLen; ++j) {\\n\\t\\tvar name = names[j];\\n\\t\\tvar api;\\n\\n\\t\\t/"
"7031","-62.139062","127.0.0.1","127.0.0.1","TCP","56","60471 > 59640 [ACK] Seq=755 Ack=35692 Win=372608 Len=0 TSval=1361430857 TSecr=1361430857",""
"7032","-62.139048","127.0.0.1","127.0.0.1","TCP","56","60471 > 59640 [ACK] Seq=755 Ack=68356 Win=339936 Len=0 TSval=1361430857 TSecr=1361430857",""
"7033","-62.139042","127.0.0.1","127.0.0.1","TCP","56","60471 > 59640 [ACK] Seq=755 Ack=68496 Win=339776 Len=0 TSval=1361430857 TSecr=1361430857",""
"7034","-62.123980","127.0.0.1","127.0.0.1","TCP","16388","59640 > 60471 [ACK] Seq=68496 Ack=755 Win=407520 Len=16332 TSval=1361430870 TSecr=1361430857","/ Create a module wrapper only if it hasn't been wrapped already.\\n\\t\\tif (apiNamespace.hasOwnProperty(name)) {\\n\\t\\t\\tapi = apiNamespace[name];\\n\\n\\t\\t} else {\\n\\t\\t\\tfunction SandboxAPI() {\\n\\t\\t\\t\\tvar proto = this.__proto__;\\n\\t\\t\\t\\tObject.defineProp"
"7035","-62.123973","127.0.0.1","127.0.0.1","TCP","16388","59640 > 60471 [ACK] Seq=84828 Ack=755 Win=407520 Len=16332 TSval=1361430870 TSecr=1361430857","== -1) {\\n\\t\\tout.search = rest.substr(qm);\\n\\t\\tout.query = rest.substr(qm+1);\\n\\t\\t/* disabled for now if (parseQueryString) {\\n\\t\\t\\tout.query = querystring.parse(out.query);\\n\\t\\t}*/\\n\\t\\trest = rest.slice(0, qm);\\n\\t}\\n\\tif (rest) out.pathname = rest"
"7036","-62.123962","127.0.0.1","127.0.0.1","TCP","16388","59640 > 60471 [ACK] Seq=101160 Ack=755 Win=407520 Len=16332 TSval=1361430870 TSecr=1361430857","\\n\\tif (self.id == '.' && self.context.currentActivity) {\\n\\t\\tglobal.require = require;\\n\\t\\tTitanium.Android.currentActivity = self.context.currentActivity;\\n\\n\\t\\treturn runInThisContext(source, filename, true);\\n\\t}\\n\\n\\t// Create context-bound module"
"7037","-62.123958","127.0.0.1","127.0.0.1","TCP","16388","59640 > 60471 [ACK] Seq=117492 Ack=755 Win=407520 Len=16332 TSval=1361430870 TSecr=1361430857",",""source"":""(function (exports, require, module, __filename, __dirname, Titanium, Ti, global, kroll) {/**\\n * Appcelerator Titanium Mobile\\n * Copyright (c) 2012-2014 by Appcelerator, Inc. All Rights Reserved.\\n * Licensed under the terms of the Apache Pub"
"7038","-62.123946","127.0.0.1","127.0.0.1","TCP","10003","59640 > 60471 [PSH, ACK] Seq=133824 Ack=755 Win=407520 Len=9947 TSval=1361430870 TSecr=1361430857","-1;\\n\\t\\t\\t// Also support listener indexes / ids\\n\\t\\t\\tif (typeof listener === 'number') {\\n\\t\\t\\t\\tposition = listener;\\n\\t\\t\\t\\tif (position > list.length || position < 0) {\\n\\t\\t\\t\\t\\treturn this;\\n\\t\\t\\t\\t}\\n\\t\\t\\t} else {\\n\\t\\t\\t\\tfor (var i = 0, l"
"7039","-62.123926","127.0.0.1","127.0.0.1","TCP","56","60471 > 59640 [ACK] Seq=755 Ack=101160 Win=307136 Len=0 TSval=1361430870 TSecr=1361430870",""
"7040","-62.123916","127.0.0.1","127.0.0.1","TCP","56","60471 > 59640 [ACK] Seq=755 Ack=133824 Win=274464 Len=0 TSval=1361430870 TSecr=1361430870",""
"7041","-62.123908","127.0.0.1","127.0.0.1","TCP","56","60471 > 59640 [ACK] Seq=755 Ack=143771 Win=264512 Len=0 TSval=1361430870 TSecr=1361430870",""
"7042","-62.092907","127.0.0.1","127.0.0.1","TCP","70","60471 > 59640 [PSH, ACK] Seq=755 Ack=143771 Win=264512 Len=14 TSval=1361430895 TSecr=1361430870","Content-Length"
"7043","-62.092857","127.0.0.1","127.0.0.1","TCP","56","59640 > 60471 [ACK] Seq=143771 Ack=769 Win=407520 Len=0 TSval=1361430895 TSecr=1361430895",""
"7044","-62.092833","127.0.0.1","127.0.0.1","TCP","57","60471 > 59640 [PSH, ACK] Seq=769 Ack=143771 Win=264512 Len=1 TSval=1361430895 TSecr=1361430895",":"
"7045","-62.092816","127.0.0.1","127.0.0.1","TCP","56","59640 > 60471 [ACK] Seq=143771 Ack=770 Win=407520 Len=0 TSval=1361430895 TSecr=1361430895",""
"7046","-62.092806","127.0.0.1","127.0.0.1","TCP","58","60471 > 59640 [PSH, ACK] Seq=770 Ack=143771 Win=264512 Len=2 TSval=1361430895 TSecr=1361430895","47"
"7047","-62.092791","127.0.0.1","127.0.0.1","TCP","56","59640 > 60471 [ACK] Seq=143771 Ack=772 Win=407520 Len=0 TSval=1361430895 TSecr=1361430895",""
"7048","-62.092781","127.0.0.1","127.0.0.1","TCP","107","60471 > 59640 [PSH, ACK] Seq=772 Ack=143771 Win=264512 Len=51 TSval=1361430895 TSecr=1361430895","\\r\\n\\r\\n{""seq"":8,""type"":""request"",""command"":""continue""}"
"7049","-62.092774","127.0.0.1","127.0.0.1","TCP","56","59640 > 60471 [ACK] Seq=143771 Ack=823 Win=407456 Len=0 TSval=1361430895 TSecr=1361430895",""
"7050","-62.084985","127.0.0.1","127.0.0.1","TCP","76","59640 > 60471 [PSH, ACK] Seq=143771 Ack=823 Win=407456 Len=20 TSval=1361430902 TSecr=1361430895","Content-Length: 94\\r\\n"
"7051","-62.084956","127.0.0.1","127.0.0.1","TCP","56","60471 > 59640 [ACK] Seq=823 Ack=143791 Win=264480 Len=0 TSval=1361430902 TSecr=1361430902",""
"7052","-62.043530","127.0.0.1","127.0.0.1","TCP","932","59640 > 60471 [PSH, ACK] Seq=143791 Ack=823 Win=407456 Len=876 TSval=1361430936 TSecr=1361430902","\\r\\n{""seq"":7,""request_seq"":8,""type"":""response"",""command"":""continue"",""success"":true,""running"":true}Content-Length: 460\\r\\n\\r\\n{""seq"":8,""type"":""event"",""event"":""afterCompile"",""success"":true,""body"":{""script"":{""handle"":1,""type"":""script"",""name"":""app.js"",""id"":37"
"7053","-62.043505","127.0.0.1","127.0.0.1","TCP","56","60471 > 59640 [ACK] Seq=823 Ack=144667 Win=263616 Len=0 TSval=1361430936 TSecr=1361430936",""
"7054","-62.040603","127.0.0.1","127.0.0.1","TCP","70","60471 > 59640 [PSH, ACK] Seq=823 Ack=144667 Win=263616 Len=14 TSval=1361430938 TSecr=1361430936","Content-Length"
"7055","-62.040572","127.0.0.1","127.0.0.1","TCP","56","59640 > 60471 [ACK] Seq=144667 Ack=837 Win=407456 Len=0 TSval=1361430938 TSecr=1361430938",""
"7056","-62.040559","127.0.0.1","127.0.0.1","TCP","63","60471 > 59640 [PSH, ACK] Seq=837 Ack=144667 Win=263616 Len=7 TSval=1361430938 TSecr=1361430938",":92\\r\\n\\r\\n"
"7057","-62.040549","127.0.0.1","127.0.0.1","TCP","56","59640 > 60471 [ACK] Seq=144667 Ack=844 Win=407456 Len=0 TSval=1361430938 TSecr=1361430938",""
"7058","-62.040532","127.0.0.1","127.0.0.1","TCP","148","60471 > 59640 [PSH, ACK] Seq=844 Ack=144667 Win=263616 Len=92 TSval=1361430938 TSecr=1361430938","{""seq"":9,""type"":""request"",""command"":""scripts"",""arguments"":{""includeSource"":true,""ids"":[37]}}"
"7059","-62.040524","127.0.0.1","127.0.0.1","TCP","56","59640 > 60471 [ACK] Seq=144667 Ack=936 Win=407360 Len=0 TSval=1361430938 TSecr=1361430938",""
"7060","-62.040083","127.0.0.1","127.0.0.1","TCP","70","60471 > 59640 [PSH, ACK] Seq=936 Ack=144667 Win=263616 Len=14 TSval=1361430939 TSecr=1361430938","Content-Length"
"7061","-62.040057","127.0.0.1","127.0.0.1","TCP","56","59640 > 60471 [ACK] Seq=144667 Ack=950 Win=407328 Len=0 TSval=1361430939 TSecr=1361430939",""
"7062","-62.040044","127.0.0.1","127.0.0.1","TCP","61","60471 > 59640 [PSH, ACK] Seq=950 Ack=144667 Win=263616 Len=5 TSval=1361430939 TSecr=1361430939",":81\\r\\n"
"7063","-62.040035","127.0.0.1","127.0.0.1","TCP","56","59640 > 60471 [ACK] Seq=144667 Ack=955 Win=407328 Len=0 TSval=1361430939 TSecr=1361430939",""
"7064","-62.040027","127.0.0.1","127.0.0.1","TCP","139","60471 > 59640 [PSH, ACK] Seq=955 Ack=144667 Win=263616 Len=83 TSval=1361430939 TSecr=1361430939","\\r\\n{""seq"":10,""type"":""request"",""command"":""backtrace"",""arguments"":{""inlineRefs"":true}}"
"7065","-62.040019","127.0.0.1","127.0.0.1","TCP","56","59640 > 60471 [ACK] Seq=144667 Ack=1038 Win=407232 Len=0 TSval=1361430939 TSecr=1361430939",""
"7066","-62.017237","127.0.0.1","127.0.0.1","TCP","78","59640 > 60471 [PSH, ACK] Seq=144667 Ack=1038 Win=407232 Len=22 TSval=1361430959 TSecr=1361430939","Content-Length: 1628\\r\\n"
"7067","-62.017211","127.0.0.1","127.0.0.1","TCP","56","60471 > 59640 [ACK] Seq=1038 Ack=144689 Win=263584 Len=0 TSval=1361430959 TSecr=1361430959",""
"7068","-61.978773","127.0.0.1","127.0.0.1","TCP","6768","59640 > 60471 [PSH, ACK] Seq=144689 Ack=1038 Win=407232 Len=6712 TSval=1361430991 TSecr=1361430959","\\r\\n{""seq"":10,""request_seq"":9,""type"":""response"",""command"":""scripts"",""success"":true,""body"":[{""handle"":7,""type"":""script"",""name"":""app.js"",""id"":37,""lineOffset"":0,""columnOffset"":0,""lineCount"":67,""source"":""// this sets the background color of the master UIView "
"7069","-61.978746","127.0.0.1","127.0.0.1","TCP","56","60471 > 59640 [ACK] Seq=1038 Ack=151401 Win=518208 Len=0 TSval=1361430991 TSecr=1361430991",""
"7348","-60.805096","127.0.0.1","127.0.0.1","TCP","70","60471 > 59640 [PSH, ACK] Seq=1038 Ack=151401 Win=518208 Len=14 TSval=1361432067 TSecr=1361430991","Content-Length"
"7349","-60.805061","127.0.0.1","127.0.0.1","TCP","56","59640 > 60471 [ACK] Seq=151401 Ack=1052 Win=407232 Len=0 TSval=1361432067 TSecr=1361432067",""
"7350","-60.804943","127.0.0.1","127.0.0.1","TCP","57","60471 > 59640 [PSH, ACK] Seq=1052 Ack=151401 Win=518208 Len=1 TSval=1361432067 TSecr=1361432067",":"
"7351","-60.804926","127.0.0.1","127.0.0.1","TCP","56","59640 > 60471 [ACK] Seq=151401 Ack=1053 Win=407232 Len=0 TSval=1361432067 TSecr=1361432067",""
"7352","-60.804917","127.0.0.1","127.0.0.1","TCP","60","60471 > 59640 [PSH, ACK] Seq=1053 Ack=151401 Win=518208 Len=4 TSval=1361432067 TSecr=1361432067","93\\r\\n"
"7353","-60.804910","127.0.0.1","127.0.0.1","TCP","56","59640 > 60471 [ACK] Seq=151401 Ack=1057 Win=407232 Len=0 TSval=1361432067 TSecr=1361432067",""
"7354","-60.804904","127.0.0.1","127.0.0.1","TCP","151","60471 > 59640 [PSH, ACK] Seq=1057 Ack=151401 Win=518208 Len=95 TSval=1361432067 TSecr=1361432067","\\r\\n{""seq"":11,""type"":""request"",""command"":""lookup"",""arguments"":{""handles"":[1],""inlineRefs"":false}}"
"7355","-60.804899","127.0.0.1","127.0.0.1","TCP","56","59640 > 60471 [ACK] Seq=151401 Ack=1152 Win=407136 Len=0 TSval=1361432067 TSecr=1361432067",""
"7356","-60.801235","127.0.0.1","127.0.0.1","TCP","2141","59640 > 60471 [PSH, ACK] Seq=151401 Ack=1152 Win=407136 Len=2085 TSval=1361432070 TSecr=1361432067","Content-Length: 2061\\r\\n\\r\\n{""seq"":12,""request_seq"":11,""type"":""response"",""command"":""lookup"",""success"":true,""body"":{""1"":{""handle"":1,""type"":""object"",""className"":""global"",""constructorFunction"":{""ref"":26},""protoObject"":{""ref"":3},""prototypeObject"":{""ref"":2},""p"
"7357","-60.801212","127.0.0.1","127.0.0.1","TCP","56","60471 > 59640 [ACK] Seq=1152 Ack=153486 Win=516096 Len=0 TSval=1361432070 TSecr=1361432070",""
"7358","-60.790787","127.0.0.1","127.0.0.1","TCP","70","60471 > 59640 [PSH, ACK] Seq=1152 Ack=153486 Win=516096 Len=14 TSval=1361432080 TSecr=1361432070","Content-Length"
"7359","-60.790750","127.0.0.1","127.0.0.1","TCP","56","59640 > 60471 [ACK] Seq=153486 Ack=1166 Win=407104 Len=0 TSval=1361432080 TSecr=1361432080",""
"7360","-60.790733","127.0.0.1","127.0.0.1","TCP","62","60471 > 59640 [PSH, ACK] Seq=1166 Ack=153486 Win=516096 Len=6 TSval=1361432080 TSecr=1361432080",":104\\r\\n"
"7361","-60.790723","127.0.0.1","127.0.0.1","TCP","56","59640 > 60471 [ACK] Seq=153486 Ack=1172 Win=407104 Len=0 TSval=1361432080 TSecr=1361432080",""
"7362","-60.790713","127.0.0.1","127.0.0.1","TCP","162","60471 > 59640 [PSH, ACK] Seq=1172 Ack=153486 Win=516096 Len=106 TSval=1361432080 TSecr=1361432080","\\r\\n{""seq"":12,""type"":""request"",""command"":""scope"",""arguments"":{""number"":0,""frameNumber"":0,""inlineRefs"":true}}"
"7363","-60.790705","127.0.0.1","127.0.0.1","TCP","56","59640 > 60471 [ACK] Seq=153486 Ack=1278 Win=407008 Len=0 TSval=1361432080 TSecr=1361432080",""
"7364","-60.743278","127.0.0.1","127.0.0.1","TCP","79","59640 > 60471 [PSH, ACK] Seq=153486 Ack=1278 Win=407008 Len=23 TSval=1361432125 TSecr=1361432080","Content-Length: 64584\\r\\n"
"7365","-60.743253","127.0.0.1","127.0.0.1","TCP","56","60471 > 59640 [ACK] Seq=1278 Ack=153509 Win=516096 Len=0 TSval=1361432125 TSecr=1361432125",""
"7366","-60.699543","127.0.0.1","127.0.0.1","TCP","16388","59640 > 60471 [ACK] Seq=153509 Ack=1278 Win=407008 Len=16332 TSval=1361432166 TSecr=1361432125","\\r\\n{""seq"":13,""request_seq"":12,""type"":""response"",""command"":""scope"",""success"":true,""body"":{""type"":0,""index"":0,""frameIndex"":0,""object"":{""handle"":44,""type"":""object"",""className"":""Object"",""constructorFunction"":{""ref"":26,""type"":""function"",""name"":""Object"",""infer"
"7367","-60.699538","127.0.0.1","127.0.0.1","TCP","16388","59640 > 60471 [ACK] Seq=169841 Ack=1278 Win=407008 Len=16332 TSval=1361432166 TSecr=1361432125","ror"",""value"":""TypeError""}},{""name"":""length"",""value"":{""ref"":33,""type"":""number"",""value"":1}},{""name"":""arguments"",""value"":{""ref"":5,""type"":""null"",""value"":null}},{""name"":""caller"",""value"":{""ref"":5,""type"":""null"",""value"":null}}],""text"":""function TypeError() { [nat"
"7368","-60.699536","127.0.0.1","127.0.0.1","TCP","16388","59640 > 60471 [ACK] Seq=186173 Ack=1278 Win=407008 Len=16332 TSval=1361432166 TSecr=1361432125","type"":""null"",""value"":null}},{""name"":""caller"",""value"":{""ref"":5,""type"":""null"",""value"":null}}],""text"":""function () {\\n\\t\\treturn Titanium.clearTimeout.apply(Titanium, arguments);\\n\\t}""},{""handle"":75,""type"":""object"",""className"":""JSON"",""constructorFunction"":{"""
"7369","-60.699534","127.0.0.1","127.0.0.1","TCP","15646","59640 > 60471 [PSH, ACK] Seq=202505 Ack=1278 Win=407008 Len=15590 TSval=1361432166 TSecr=1361432125","nction"",""name"":""freeze"",""inferredName"":"""",""scriptId"":4}},{""name"":""caller"",""value"":{""ref"":5,""type"":""null"",""value"":null}},{""name"":""defineProperties"",""value"":{""ref"":36,""type"":""function"",""name"":""defineProperties"",""inferredName"":"""",""scriptId"":4}},{""name"":""isSe"
"7370","-60.699522","127.0.0.1","127.0.0.1","TCP","56","60471 > 59640 [ACK] Seq=1278 Ack=186173 Win=483424 Len=0 TSval=1361432166 TSecr=1361432166",""
"7371","-60.699513","127.0.0.1","127.0.0.1","TCP","56","60471 > 59640 [ACK] Seq=1278 Ack=218095 Win=451488 Len=0 TSval=1361432166 TSecr=1361432166",""
"7372","-60.674645","127.0.0.1","127.0.0.1","TCP","70","60471 > 59640 [PSH, ACK] Seq=1278 Ack=218095 Win=451488 Len=14 TSval=1361432190 TSecr=1361432166","Content-Length"
"7373","-60.674613","127.0.0.1","127.0.0.1","TCP","56","59640 > 60471 [ACK] Seq=218095 Ack=1292 Win=407008 Len=0 TSval=1361432190 TSecr=1361432190",""
"7374","-60.674600","127.0.0.1","127.0.0.1","TCP","64","60471 > 59640 [PSH, ACK] Seq=1292 Ack=218095 Win=451488 Len=8 TSval=1361432190 TSecr=1361432190",":136\\r\\n\\r\\n"
"7375","-60.674594","127.0.0.1","127.0.0.1","TCP","56","59640 > 60471 [ACK] Seq=218095 Ack=1300 Win=406976 Len=0 TSval=1361432190 TSecr=1361432190",""
"7376","-60.674587","127.0.0.1","127.0.0.1","TCP","192","60471 > 59640 [PSH, ACK] Seq=1300 Ack=218095 Win=451488 Len=136 TSval=1361432190 TSecr=1361432190","{""seq"":13,""type"":""request"",""command"":""evaluate"",""arguments"":{""disable_break"":true,""expression"":""this;"",""inlineRefs"":true,""global"":true}}"
"7377","-60.674583","127.0.0.1","127.0.0.1","TCP","56","59640 > 60471 [ACK] Seq=218095 Ack=1436 Win=406848 Len=0 TSval=1361432190 TSecr=1361432190",""
"7378","-60.669514","127.0.0.1","127.0.0.1","TCP","77","59640 > 60471 [PSH, ACK] Seq=218095 Ack=1436 Win=406848 Len=21 TSval=1361432194 TSecr=1361432190","Content-Length: 392\\r\\n"
"7379","-60.669491","127.0.0.1","127.0.0.1","TCP","56","60471 > 59640 [ACK] Seq=1436 Ack=218116 Win=451488 Len=0 TSval=1361432194 TSecr=1361432194",""
"7380","-60.631946","127.0.0.1","127.0.0.1","TCP","450","59640 > 60471 [PSH, ACK] Seq=218116 Ack=1436 Win=406848 Len=394 TSval=1361432231 TSecr=1361432194","\\r\\n{""seq"":14,""request_seq"":13,""type"":""response"",""command"":""evaluate"",""success"":true,""body"":{""handle"":1,""type"":""object"",""className"":""global"",""constructorFunction"":{""ref"":26,""type"":""function"",""name"":""Object"",""inferredName"":""""},""protoObject"":{""ref"":3,""type"""
"7381","-60.631916","127.0.0.1","127.0.0.1","TCP","56","60471 > 59640 [ACK] Seq=1436 Ack=218510 Win=451072 Len=0 TSval=1361432231 TSecr=1361432231",""
"7382","-60.628020","127.0.0.1","127.0.0.1","TCP","70","60471 > 59640 [PSH, ACK] Seq=1436 Ack=218510 Win=451072 Len=14 TSval=1361432235 TSecr=1361432231","Content-Length"
"7383","-60.627963","127.0.0.1","127.0.0.1","TCP","56","59640 > 60471 [ACK] Seq=218510 Ack=1450 Win=406848 Len=0 TSval=1361432235 TSecr=1361432235",""
"7384","-60.627944","127.0.0.1","127.0.0.1","TCP","156","60471 > 59640 [PSH, ACK] Seq=1450 Ack=218510 Win=451072 Len=100 TSval=1361432235 TSecr=1361432235",":93\\r\\n\\r\\n{""seq"":14,""type"":""request"",""command"":""lookup"",""arguments"":{""handles"":[3],""inlineRefs"":false}}"
"7385","-60.627936","127.0.0.1","127.0.0.1","TCP","56","59640 > 60471 [ACK] Seq=218510 Ack=1550 Win=406720 Len=0 TSval=1361432235 TSecr=1361432235",""
"7386","-60.622728","127.0.0.1","127.0.0.1","TCP","78","59640 > 60471 [PSH, ACK] Seq=218510 Ack=1550 Win=406720 Len=22 TSval=1361432240 TSecr=1361432235","Content-Length: 2804\\r\\n"
"7387","-60.622704","127.0.0.1","127.0.0.1","TCP","56","60471 > 59640 [ACK] Seq=1550 Ack=218532 Win=451072 Len=0 TSval=1361432240 TSecr=1361432240",""
"7388","-60.580618","127.0.0.1","127.0.0.1","TCP","2862","59640 > 60471 [PSH, ACK] Seq=218532 Ack=1550 Win=406720 Len=2806 TSval=1361432280 TSecr=1361432240","\\r\\n{""seq"":15,""request_seq"":14,""type"":""response"",""command"":""lookup"",""success"":true,""body"":{""3"":{""handle"":3,""type"":""object"",""className"":""Object"",""constructorFunction"":{""ref"":26},""protoObject"":{""ref"":4},""prototypeObject"":{""ref"":2},""properties"":[{""name"":""con"
"7389","-60.580583","127.0.0.1","127.0.0.1","TCP","56","60471 > 59640 [ACK] Seq=1550 Ack=221338 Win=448256 Len=0 TSval=1361432280 TSecr=1361432280",""
"12912","26.292057","127.0.0.1","127.0.0.1","TCP","70","60471 > 59640 [PSH, ACK] Seq=1550 Ack=221338 Win=448256 Len=14 TSval=1361517468 TSecr=1361432280","Content-Length"
"12913","26.292089","127.0.0.1","127.0.0.1","TCP","56","59640 > 60471 [ACK] Seq=221338 Ack=1564 Win=406720 Len=0 TSval=1361517468 TSecr=1361517468",""
"12914","26.292238","127.0.0.1","127.0.0.1","TCP","57","60471 > 59640 [PSH, ACK] Seq=1564 Ack=221338 Win=448256 Len=1 TSval=1361517468 TSecr=1361517468",":"
"12915","26.292259","127.0.0.1","127.0.0.1","TCP","56","59640 > 60471 [ACK] Seq=221338 Ack=1565 Win=406720 Len=0 TSval=1361517468 TSecr=1361517468",""
"12916","26.292439","127.0.0.1","127.0.0.1","TCP","58","60471 > 59640 [PSH, ACK] Seq=1565 Ack=221338 Win=448256 Len=2 TSval=1361517468 TSecr=1361517468","94"
"12917","26.292464","127.0.0.1","127.0.0.1","TCP","56","59640 > 60471 [ACK] Seq=221338 Ack=1567 Win=406720 Len=0 TSval=1361517468 TSecr=1361517468",""
"12918","26.292476","127.0.0.1","127.0.0.1","TCP","154","60471 > 59640 [PSH, ACK] Seq=1567 Ack=221338 Win=448256 Len=98 TSval=1361517468 TSecr=1361517468","\\r\\n\\r\\n{""seq"":15,""type"":""request"",""command"":""continue"",""arguments"":{""stepaction"":""in"",""stepcount"":1}}"
"12919","26.292488","127.0.0.1","127.0.0.1","TCP","56","59640 > 60471 [ACK] Seq=221338 Ack=1665 Win=406624 Len=0 TSval=1361517468 TSecr=1361517468",""
"12920","26.300311","127.0.0.1","127.0.0.1","TCP","507","59640 > 60471 [PSH, ACK] Seq=221338 Ack=1665 Win=406624 Len=451 TSval=1361517475 TSecr=1361517468","Content-Length: 96\\r\\n\\r\\n{""seq"":16,""request_seq"":15,""type"":""response"",""command"":""continue"",""success"":true,""running"":true}Content-Length: 310\\r\\n\\r\\n{""seq"":17,""type"":""event"",""event"":""break"",""body"":{""invocationText"":""#<UI>.createWindow(aka invoker)(#<Objec"
"12921","26.300333","127.0.0.1","127.0.0.1","TCP","56","60471 > 59640 [ACK] Seq=1665 Ack=221789 Win=447808 Len=0 TSval=1361517475 TSecr=1361517475",""
"12922","26.302492","127.0.0.1","127.0.0.1","TCP","70","60471 > 59640 [PSH, ACK] Seq=1665 Ack=221789 Win=447808 Len=14 TSval=1361517477 TSecr=1361517475","Content-Length"
"12923","26.302533","127.0.0.1","127.0.0.1","TCP","56","59640 > 60471 [ACK] Seq=221789 Ack=1679 Win=406592 Len=0 TSval=1361517477 TSecr=1361517477",""
"12924","26.302569","127.0.0.1","127.0.0.1","TCP","57","60471 > 59640 [PSH, ACK] Seq=1679 Ack=221789 Win=447808 Len=1 TSval=1361517477 TSecr=1361517477",":"
"12925","26.302595","127.0.0.1","127.0.0.1","TCP","56","59640 > 60471 [ACK] Seq=221789 Ack=1680 Win=406592 Len=0 TSval=1361517477 TSecr=1361517477",""
"12926","26.302608","127.0.0.1","127.0.0.1","TCP","62","60471 > 59640 [PSH, ACK] Seq=1680 Ack=221789 Win=447808 Len=6 TSval=1361517477 TSecr=1361517477","81\\r\\n\\r\\n"
"12927","26.302618","127.0.0.1","127.0.0.1","TCP","56","59640 > 60471 [ACK] Seq=221789 Ack=1686 Win=406592 Len=0 TSval=1361517477 TSecr=1361517477",""
"12928","26.302628","127.0.0.1","127.0.0.1","TCP","137","60471 > 59640 [PSH, ACK] Seq=1686 Ack=221789 Win=447808 Len=81 TSval=1361517477 TSecr=1361517477","{""seq"":16,""type"":""request"",""command"":""backtrace"",""arguments"":{""inlineRefs"":true}}"
"12929","26.302635","127.0.0.1","127.0.0.1","TCP","56","59640 > 60471 [ACK] Seq=221789 Ack=1767 Win=406528 Len=0 TSval=1361517477 TSecr=1361517477",""
"12930","26.307544","127.0.0.1","127.0.0.1","TCP","78","59640 > 60471 [PSH, ACK] Seq=221789 Ack=1767 Win=406528 Len=22 TSval=1361517482 TSecr=1361517477","Content-Length: 6162\\r\\n"
"12931","26.307578","127.0.0.1","127.0.0.1","TCP","56","60471 > 59640 [ACK] Seq=1767 Ack=221811 Win=447776 Len=0 TSval=1361517482 TSecr=1361517482",""
"12932","26.346915","127.0.0.1","127.0.0.1","TCP","6220","59640 > 60471 [PSH, ACK] Seq=221811 Ack=1767 Win=406528 Len=6164 TSval=1361517520 TSecr=1361517482","\\r\\n{""seq"":18,""request_seq"":16,""type"":""response"",""command"":""backtrace"",""success"":true,""body"":{""fromFrame"":0,""toFrame"":5,""totalFrames"":5,""frames"":[{""type"":""frame"",""index"":0,""receiver"":{""ref"":1,""type"":""object"",""className"":""Object""},""func"":{""ref"":0,""type"":""f"
"12933","26.346955","127.0.0.1","127.0.0.1","TCP","56","60471 > 59640 [ACK] Seq=1767 Ack=227975 Win=441632 Len=0 TSval=1361517520 TSecr=1361517520",""
"12934","26.586456","127.0.0.1","127.0.0.1","TCP","70","60471 > 59640 [PSH, ACK] Seq=1767 Ack=227975 Win=441632 Len=14 TSval=1361517758 TSecr=1361517520","Content-Length"
"12935","26.586491","127.0.0.1","127.0.0.1","TCP","56","59640 > 60471 [ACK] Seq=227975 Ack=1781 Win=406496 Len=0 TSval=1361517758 TSecr=1361517758",""
"12936","26.586505","127.0.0.1","127.0.0.1","TCP","63","60471 > 59640 [PSH, ACK] Seq=1781 Ack=227975 Win=441632 Len=7 TSval=1361517758 TSecr=1361517758",":93\\r\\n\\r\\n"
"12937","26.586513","127.0.0.1","127.0.0.1","TCP","56","59640 > 60471 [ACK] Seq=227975 Ack=1788 Win=406496 Len=0 TSval=1361517758 TSecr=1361517758",""
"12938","26.586522","127.0.0.1","127.0.0.1","TCP","149","60471 > 59640 [PSH, ACK] Seq=1788 Ack=227975 Win=441632 Len=93 TSval=1361517758 TSecr=1361517758","{""seq"":17,""type"":""request"",""command"":""lookup"",""arguments"":{""handles"":[1],""inlineRefs"":false}}"
"12939","26.586529","127.0.0.1","127.0.0.1","TCP","56","59640 > 60471 [ACK] Seq=227975 Ack=1881 Win=406400 Len=0 TSval=1361517758 TSecr=1361517758",""
"12940","26.609055","127.0.0.1","127.0.0.1","TCP","79","59640 > 60471 [PSH, ACK] Seq=227975 Ack=1881 Win=406400 Len=23 TSval=1361517779 TSecr=1361517758","Content-Length: 45616\\r\\n"
"12941","26.609085","127.0.0.1","127.0.0.1","TCP","56","60471 > 59640 [ACK] Seq=1881 Ack=227998 Win=441600 Len=0 TSval=1361517779 TSecr=1361517779",""
"12942","26.613470","127.0.0.1","127.0.0.1","TCP","16388","59640 > 60471 [ACK] Seq=227998 Ack=1881 Win=406400 Len=16332 TSval=1361517782 TSecr=1361517779","\\r\\n{""seq"":19,""request_seq"":17,""type"":""response"",""command"":""lookup"",""success"":true,""body"":{""1"":{""handle"":1,""type"":""object"",""className"":""Object"",""constructorFunction"":{""ref"":2},""protoObject"":{""ref"":4},""prototypeObject"":{""ref"":3},""properties"":[{""name"":""crea"
"12943","26.613476","127.0.0.1","127.0.0.1","TCP","16388","59640 > 60471 [ACK] Seq=244330 Ack=1881 Win=406400 Len=16332 TSval=1361517782 TSecr=1361517779","Type"":2,""ref"":114},{""name"":""createSearchView"",""propertyType"":2,""ref"":115},{""name"":""_events"",""attributes"":6,""propertyType"":3,""ref"":3}],""text"":""#<Android>""},{""handle"":45,""type"":""function"",""className"":""Function"",""constructorFunction"":{""ref"":70},""protoObject"""
"12944","26.613479","127.0.0.1","127.0.0.1","TCP","1246","59640 > 60471 [PSH, ACK] Seq=260662 Ack=1881 Win=406400 Len=1190 TSval=1361517782 TSecr=1361517779",",""propertyType"":3,""ref"":94},{""name"":""prototype"",""attributes"":6,""propertyType"":3,""ref"":140},{""name"":""__delegate__"",""propertyType"":1,""ref"":141},{""name"":""length"",""attributes"":7,""propertyType"":3,""ref"":74},{""name"":""__thisObj__"",""propertyType"":1,""ref"":4},{""name"
"12945","26.613502","127.0.0.1","127.0.0.1","TCP","56","60471 > 59640 [ACK] Seq=1881 Ack=260662 Win=408928 Len=0 TSval=1361517782 TSecr=1361517782",""
"12946","26.613509","127.0.0.1","127.0.0.1","TCP","56","60471 > 59640 [ACK] Seq=1881 Ack=261852 Win=407744 Len=0 TSval=1361517782 TSecr=1361517782",""
"12947","26.618517","127.0.0.1","127.0.0.1","TCP","11820","59640 > 60471 [PSH, ACK] Seq=261852 Ack=1881 Win=406400 Len=11764 TSval=1361517787 TSecr=1361517782","tyType"":3,""ref"":142},{""name"":""__delegate__"",""propertyType"":1,""ref"":143},{""name"":""length"",""attributes"":7,""propertyType"":3,""ref"":74},{""name"":""__thisObj__"",""propertyType"":1,""ref"":4},{""name"":""__scopeVars__"",""propertyType"":1,""ref"":96},{""name"":""arguments"",""attr"
"12948","26.618548","127.0.0.1","127.0.0.1","TCP","56","60471 > 59640 [ACK] Seq=1881 Ack=273616 Win=395968 Len=0 TSval=1361517787 TSecr=1361517787",""
"12949","26.621813","127.0.0.1","127.0.0.1","TCP","70","60471 > 59640 [PSH, ACK] Seq=1881 Ack=273616 Win=395968 Len=14 TSval=1361517790 TSecr=1361517787","Content-Length"
"12950","26.621840","127.0.0.1","127.0.0.1","TCP","56","59640 > 60471 [ACK] Seq=273616 Ack=1895 Win=406400 Len=0 TSval=1361517790 TSecr=1361517790",""
"12951","26.621851","127.0.0.1","127.0.0.1","TCP","57","60471 > 59640 [PSH, ACK] Seq=1895 Ack=273616 Win=395968 Len=1 TSval=1361517790 TSecr=1361517790",":"
"12952","26.621859","127.0.0.1","127.0.0.1","TCP","56","59640 > 60471 [ACK] Seq=273616 Ack=1896 Win=406400 Len=0 TSval=1361517790 TSecr=1361517790",""
"12953","26.621865","127.0.0.1","127.0.0.1","TCP","61","60471 > 59640 [PSH, ACK] Seq=1896 Ack=273616 Win=395968 Len=5 TSval=1361517790 TSecr=1361517790","104\\r\\n"
"12954","26.621871","127.0.0.1","127.0.0.1","TCP","56","59640 > 60471 [ACK] Seq=273616 Ack=1901 Win=406400 Len=0 TSval=1361517790 TSecr=1361517790",""
"12955","26.621882","127.0.0.1","127.0.0.1","TCP","162","60471 > 59640 [PSH, ACK] Seq=1901 Ack=273616 Win=395968 Len=106 TSval=1361517790 TSecr=1361517790","\\r\\n{""seq"":18,""type"":""request"",""command"":""scope"",""arguments"":{""number"":0,""frameNumber"":0,""inlineRefs"":true}}"
"12956","26.621886","127.0.0.1","127.0.0.1","TCP","56","59640 > 60471 [ACK] Seq=273616 Ack=2007 Win=406272 Len=0 TSval=1361517790 TSecr=1361517790",""
"12957","26.629203","127.0.0.1","127.0.0.1","TCP","78","59640 > 60471 [PSH, ACK] Seq=273616 Ack=2007 Win=406272 Len=22 TSval=1361517797 TSecr=1361517790","Content-Length: 1156\\r\\n"
"12958","26.629235","127.0.0.1","127.0.0.1","TCP","56","60471 > 59640 [ACK] Seq=2007 Ack=273638 Win=395968 Len=0 TSval=1361517797 TSecr=1361517797",""
