"No.","Time","Source","Destination","Protocol","Length","Info","New Column"
"83","0.607732","127.0.0.1","127.0.0.1","TCP","68","60025 > 59876 [SYN] Seq=0 Win=65535 Len=0 MSS=16344 WS=32 TSval=1459032570 TSecr=0 SACK_PERM=1",""
"84","0.607771","127.0.0.1","127.0.0.1","TCP","44","59876 > 60025 [RST, ACK] Seq=1 Ack=1 Win=0 Len=0",""
"119","1.611905","127.0.0.1","127.0.0.1","TCP","68","60042 > 59876 [SYN] Seq=0 Win=65535 Len=0 MSS=16344 WS=32 TSval=1459033568 TSecr=0 SACK_PERM=1",""
"120","1.611934","127.0.0.1","127.0.0.1","TCP","44","59876 > 60042 [RST, ACK] Seq=1 Ack=1 Win=0 Len=0",""
"153","2.615980","127.0.0.1","127.0.0.1","TCP","68","60059 > 59876 [SYN] Seq=0 Win=65535 Len=0 MSS=16344 WS=32 TSval=1459034565 TSecr=0 SACK_PERM=1",""
"154","2.616011","127.0.0.1","127.0.0.1","TCP","44","59876 > 60059 [RST, ACK] Seq=1 Ack=1 Win=0 Len=0",""
"187","3.620308","127.0.0.1","127.0.0.1","TCP","68","60076 > 59876 [SYN, ECN, CWR] Seq=0 Win=65535 Len=0 MSS=16344 WS=32 TSval=1459035565 TSecr=0 SACK_PERM=1",""
"188","3.620329","127.0.0.1","127.0.0.1","TCP","44","59876 > 60076 [RST, ACK] Seq=1 Ack=1 Win=0 Len=0",""
"221","4.622029","127.0.0.1","127.0.0.1","TCP","68","60093 > 59876 [SYN] Seq=0 Win=65535 Len=0 MSS=16344 WS=32 TSval=1459036558 TSecr=0 SACK_PERM=1",""
"222","4.622054","127.0.0.1","127.0.0.1","TCP","44","59876 > 60093 [RST, ACK] Seq=1 Ack=1 Win=0 Len=0",""
"255","5.627489","127.0.0.1","127.0.0.1","TCP","68","60110 > 59876 [SYN] Seq=0 Win=65535 Len=0 MSS=16344 WS=32 TSval=1459037557 TSecr=0 SACK_PERM=1",""
"256","5.627517","127.0.0.1","127.0.0.1","TCP","44","59876 > 60110 [RST, ACK] Seq=1 Ack=1 Win=0 Len=0",""
"292","6.632029","127.0.0.1","127.0.0.1","TCP","68","60127 > 59876 [SYN] Seq=0 Win=65535 Len=0 MSS=16344 WS=32 TSval=1459038554 TSecr=0 SACK_PERM=1",""
"293","6.632049","127.0.0.1","127.0.0.1","TCP","44","59876 > 60127 [RST, ACK] Seq=1 Ack=1 Win=0 Len=0",""
"330","7.637113","127.0.0.1","127.0.0.1","TCP","68","60144 > 59876 [SYN, ECN, CWR] Seq=0 Win=65535 Len=0 MSS=16344 WS=32 TSval=1459039555 TSecr=0 SACK_PERM=1",""
"331","7.637137","127.0.0.1","127.0.0.1","TCP","44","59876 > 60144 [RST, ACK] Seq=1 Ack=1 Win=0 Len=0",""
"401","8.639200","127.0.0.1","127.0.0.1","TCP","68","60168 > 59876 [SYN, ECN, CWR] Seq=0 Win=65535 Len=0 MSS=16344 WS=32 TSval=1459040547 TSecr=0 SACK_PERM=1",""
"402","8.639223","127.0.0.1","127.0.0.1","TCP","44","59876 > 60168 [RST, ACK] Seq=1 Ack=1 Win=0 Len=0",""
"438","9.644173","127.0.0.1","127.0.0.1","TCP","68","60185 > 59876 [SYN] Seq=0 Win=65535 Len=0 MSS=16344 WS=32 TSval=1459041550 TSecr=0 SACK_PERM=1",""
"439","9.644197","127.0.0.1","127.0.0.1","TCP","44","59876 > 60185 [RST, ACK] Seq=1 Ack=1 Win=0 Len=0",""
"472","10.647640","127.0.0.1","127.0.0.1","TCP","68","60202 > 59876 [SYN, ECN, CWR] Seq=0 Win=65535 Len=0 MSS=16344 WS=32 TSval=1459042545 TSecr=0 SACK_PERM=1",""
"473","10.647694","127.0.0.1","127.0.0.1","TCP","44","59876 > 60202 [RST, ACK] Seq=1 Ack=1 Win=0 Len=0",""
"506","11.652020","127.0.0.1","127.0.0.1","TCP","68","60219 > 59876 [SYN, ECN, CWR] Seq=0 Win=65535 Len=0 MSS=16344 WS=32 TSval=1459043547 TSecr=0 SACK_PERM=1",""
"507","11.652045","127.0.0.1","127.0.0.1","TCP","44","59876 > 60219 [RST, ACK] Seq=1 Ack=1 Win=0 Len=0",""
"540","12.656149","127.0.0.1","127.0.0.1","TCP","68","60236 > 59876 [SYN] Seq=0 Win=65535 Len=0 MSS=16344 WS=32 TSval=1459044542 TSecr=0 SACK_PERM=1",""
"541","12.656180","127.0.0.1","127.0.0.1","TCP","44","59876 > 60236 [RST, ACK] Seq=1 Ack=1 Win=0 Len=0",""
"574","13.659925","127.0.0.1","127.0.0.1","TCP","68","60253 > 59876 [SYN] Seq=0 Win=65535 Len=0 MSS=16344 WS=32 TSval=1459045541 TSecr=0 SACK_PERM=1",""
"575","13.659946","127.0.0.1","127.0.0.1","TCP","44","59876 > 60253 [RST, ACK] Seq=1 Ack=1 Win=0 Len=0",""
"611","14.663367","127.0.0.1","127.0.0.1","TCP","68","60270 > 59876 [SYN, ECN, CWR] Seq=0 Win=65535 Len=0 MSS=16344 WS=32 TSval=1459046537 TSecr=0 SACK_PERM=1",""
"612","14.663392","127.0.0.1","127.0.0.1","TCP","44","59876 > 60270 [RST, ACK] Seq=1 Ack=1 Win=0 Len=0",""
"717","15.667709","127.0.0.1","127.0.0.1","TCP","68","60291 > 59876 [SYN, ECN, CWR] Seq=0 Win=65535 Len=0 MSS=16344 WS=32 TSval=1459047528 TSecr=0 SACK_PERM=1",""
"718","15.667732","127.0.0.1","127.0.0.1","TCP","44","59876 > 60291 [RST, ACK] Seq=1 Ack=1 Win=0 Len=0",""
"751","16.671021","127.0.0.1","127.0.0.1","TCP","68","60308 > 59876 [SYN, ECN, CWR] Seq=0 Win=65535 Len=0 MSS=16344 WS=32 TSval=1459048525 TSecr=0 SACK_PERM=1",""
"752","16.671046","127.0.0.1","127.0.0.1","TCP","44","59876 > 60308 [RST, ACK] Seq=1 Ack=1 Win=0 Len=0",""
"785","17.674944","127.0.0.1","127.0.0.1","TCP","68","60325 > 59876 [SYN, ECN, CWR] Seq=0 Win=65535 Len=0 MSS=16344 WS=32 TSval=1459049523 TSecr=0 SACK_PERM=1",""
"786","17.674972","127.0.0.1","127.0.0.1","TCP","44","59876 > 60325 [RST, ACK] Seq=1 Ack=1 Win=0 Len=0",""
"819","18.677901","127.0.0.1","127.0.0.1","TCP","68","60342 > 59876 [SYN, ECN, CWR] Seq=0 Win=65535 Len=0 MSS=16344 WS=32 TSval=1459050518 TSecr=0 SACK_PERM=1",""
"820","18.677930","127.0.0.1","127.0.0.1","TCP","44","59876 > 60342 [RST, ACK] Seq=1 Ack=1 Win=0 Len=0",""
"853","19.681694","127.0.0.1","127.0.0.1","TCP","68","60359 > 59876 [SYN] Seq=0 Win=65535 Len=0 MSS=16344 WS=32 TSval=1459051518 TSecr=0 SACK_PERM=1",""
"854","19.681724","127.0.0.1","127.0.0.1","TCP","44","59876 > 60359 [RST, ACK] Seq=1 Ack=1 Win=0 Len=0",""
"887","20.685103","127.0.0.1","127.0.0.1","TCP","68","60376 > 59876 [SYN, ECN, CWR] Seq=0 Win=65535 Len=0 MSS=16344 WS=32 TSval=1459052514 TSecr=0 SACK_PERM=1",""
"888","20.685130","127.0.0.1","127.0.0.1","TCP","44","59876 > 60376 [RST, ACK] Seq=1 Ack=1 Win=0 Len=0",""
"921","21.690308","127.0.0.1","127.0.0.1","TCP","68","60393 > 59876 [SYN, ECN, CWR] Seq=0 Win=65535 Len=0 MSS=16344 WS=32 TSval=1459053516 TSecr=0 SACK_PERM=1",""
"922","21.690337","127.0.0.1","127.0.0.1","TCP","44","59876 > 60393 [RST, ACK] Seq=1 Ack=1 Win=0 Len=0",""
"955","22.694469","127.0.0.1","127.0.0.1","TCP","68","60410 > 59876 [SYN, ECN, CWR] Seq=0 Win=65535 Len=0 MSS=16344 WS=32 TSval=1459054513 TSecr=0 SACK_PERM=1",""
"956","22.694499","127.0.0.1","127.0.0.1","TCP","44","59876 > 60410 [RST, ACK] Seq=1 Ack=1 Win=0 Len=0",""
"2154","23.699298","127.0.0.1","127.0.0.1","TCP","68","60440 > 59876 [SYN, ECN, CWR] Seq=0 Win=65535 Len=0 MSS=16344 WS=32 TSval=1459055463 TSecr=0 SACK_PERM=1",""
"2155","23.699324","127.0.0.1","127.0.0.1","TCP","44","59876 > 60440 [RST, ACK] Seq=1 Ack=1 Win=0 Len=0",""
"2200","24.703989","127.0.0.1","127.0.0.1","TCP","68","60457 > 59876 [SYN, ECN, CWR] Seq=0 Win=65535 Len=0 MSS=16344 WS=32 TSval=1459056461 TSecr=0 SACK_PERM=1",""
"2201","24.704017","127.0.0.1","127.0.0.1","TCP","44","59876 > 60457 [RST, ACK] Seq=1 Ack=1 Win=0 Len=0",""
"2758","25.706973","127.0.0.1","127.0.0.1","TCP","68","60481 > 59876 [SYN] Seq=0 Win=65535 Len=0 MSS=16344 WS=32 TSval=1459057377 TSecr=0 SACK_PERM=1",""
"2759","25.706989","127.0.0.1","127.0.0.1","TCP","44","59876 > 60481 [RST, ACK] Seq=1 Ack=1 Win=0 Len=0",""
"2872","26.711738","127.0.0.1","127.0.0.1","TCP","68","60505 > 59876 [SYN] Seq=0 Win=65535 Len=0 MSS=16344 WS=32 TSval=1459058271 TSecr=0 SACK_PERM=1",""
"2873","26.711863","127.0.0.1","127.0.0.1","TCP","68","59876 > 60505 [SYN, ACK] Seq=0 Ack=1 Win=65535 Len=0 MSS=16344 WS=32 TSval=1459058271 TSecr=1459058271 SACK_PERM=1",""
"2874","26.711881","127.0.0.1","127.0.0.1","TCP","56","60505 > 59876 [ACK] Seq=1 Ack=1 Win=408288 Len=0 TSval=1459058271 TSecr=1459058271",""
"2875","26.711896","127.0.0.1","127.0.0.1","TCP","56","[TCP Window Update] 59876 > 60505 [ACK] Seq=1 Ack=1 Win=408288 Len=0 TSval=1459058271 TSecr=1459058271",""
"2876","26.715883","127.0.0.1","127.0.0.1","TCP","71","59876 > 60505 [PSH, ACK] Seq=1 Ack=1 Win=408288 Len=15 TSval=1459058274 TSecr=1459058271","Type: connect\\r\\n"
"2877","26.715961","127.0.0.1","127.0.0.1","TCP","56","60505 > 59876 [ACK] Seq=1 Ack=16 Win=408256 Len=0 TSval=1459058274 TSecr=1459058274",""
"2878","26.717581","127.0.0.1","127.0.0.1","TCP","147","59876 > 60505 [PSH, ACK] Seq=16 Ack=1 Win=408288 Len=91 TSval=1459058275 TSecr=1459058274","V8-Version: 3.9.24.29\\r\\nProtocol-Version: 1\\r\\nEmbedding-Host: titanium\\r\\nContent-Length: 0\\r\\n\\r\\n"
"2879","26.717614","127.0.0.1","127.0.0.1","TCP","56","60505 > 59876 [ACK] Seq=1 Ack=107 Win=408192 Len=0 TSval=1459058275 TSecr=1459058275",""
"2880","26.718062","127.0.0.1","127.0.0.1","TCP","70","60505 > 59876 [PSH, ACK] Seq=1 Ack=107 Win=408192 Len=14 TSval=1459058275 TSecr=1459058275","Content-Length"
"2881","26.718106","127.0.0.1","127.0.0.1","TCP","56","59876 > 60505 [ACK] Seq=107 Ack=15 Win=408256 Len=0 TSval=1459058275 TSecr=1459058275",""
"2882","26.718119","127.0.0.1","127.0.0.1","TCP","110","60505 > 59876 [PSH, ACK] Seq=15 Ack=107 Win=408192 Len=54 TSval=1459058275 TSecr=1459058275",":47\\r\\n\\r\\n{""seq"":23,""type"":""request"",""command"":""version""}"
"2883","26.718132","127.0.0.1","127.0.0.1","TCP","56","59876 > 60505 [ACK] Seq=107 Ack=69 Win=408224 Len=0 TSval=1459058275 TSecr=1459058275",""
"2884","26.721884","127.0.0.1","127.0.0.1","TCP","77","59876 > 60505 [PSH, ACK] Seq=107 Ack=69 Win=408224 Len=21 TSval=1459058278 TSecr=1459058275","Content-Length: 138\\r\\n"
"2885","26.721904","127.0.0.1","127.0.0.1","TCP","56","60505 > 59876 [ACK] Seq=69 Ack=128 Win=408160 Len=0 TSval=1459058278 TSecr=1459058278",""
"2886","26.765364","127.0.0.1","127.0.0.1","TCP","196","59876 > 60505 [PSH, ACK] Seq=128 Ack=69 Win=408224 Len=140 TSval=1459058320 TSecr=1459058278","\\r\\n{""seq"":0,""request_seq"":23,""type"":""response"",""command"":""version"",""success"":true,""body"":{""V8Version"":""3.9.24.29""},""refs"":[],""running"":false}"
"2887","26.765395","127.0.0.1","127.0.0.1","TCP","56","60505 > 59876 [ACK] Seq=69 Ack=268 Win=408032 Len=0 TSval=1459058320 TSecr=1459058320",""
"2888","26.766531","127.0.0.1","127.0.0.1","TCP","70","60505 > 59876 [PSH, ACK] Seq=69 Ack=268 Win=408032 Len=14 TSval=1459058321 TSecr=1459058320","Content-Length"
"2889","26.766559","127.0.0.1","127.0.0.1","TCP","56","59876 > 60505 [ACK] Seq=268 Ack=83 Win=408192 Len=0 TSval=1459058321 TSecr=1459058321",""
"2890","26.766578","127.0.0.1","127.0.0.1","TCP","57","60505 > 59876 [PSH, ACK] Seq=83 Ack=268 Win=408032 Len=1 TSval=1459058321 TSecr=1459058321",":"
"2891","26.766594","127.0.0.1","127.0.0.1","TCP","56","59876 > 60505 [ACK] Seq=268 Ack=84 Win=408192 Len=0 TSval=1459058321 TSecr=1459058321",""
"2892","26.766608","127.0.0.1","127.0.0.1","TCP","58","60505 > 59876 [PSH, ACK] Seq=84 Ack=268 Win=408032 Len=2 TSval=1459058321 TSecr=1459058321","81"
"2893","26.766618","127.0.0.1","127.0.0.1","TCP","56","59876 > 60505 [ACK] Seq=268 Ack=86 Win=408192 Len=0 TSval=1459058321 TSecr=1459058321",""
"2894","26.766639","127.0.0.1","127.0.0.1","TCP","58","60505 > 59876 [PSH, ACK] Seq=86 Ack=268 Win=408032 Len=2 TSval=1459058321 TSecr=1459058321","\\r\\n"
"2895","26.766663","127.0.0.1","127.0.0.1","TCP","56","59876 > 60505 [ACK] Seq=268 Ack=88 Win=408192 Len=0 TSval=1459058321 TSecr=1459058321",""
"2896","26.766675","127.0.0.1","127.0.0.1","TCP","139","60505 > 59876 [PSH, ACK] Seq=88 Ack=268 Win=408032 Len=83 TSval=1459058321 TSecr=1459058321","\\r\\n{""seq"":24,""type"":""request"",""command"":""backtrace"",""arguments"":{""inlineRefs"":true}}"
"2897","26.766683","127.0.0.1","127.0.0.1","TCP","56","59876 > 60505 [ACK] Seq=268 Ack=171 Win=408128 Len=0 TSval=1459058321 TSecr=1459058321",""
"2898","26.767284","127.0.0.1","127.0.0.1","TCP","70","60505 > 59876 [PSH, ACK] Seq=171 Ack=268 Win=408032 Len=14 TSval=1459058321 TSecr=1459058321","Content-Length"
"2899","26.767303","127.0.0.1","127.0.0.1","TCP","56","59876 > 60505 [ACK] Seq=268 Ack=185 Win=408096 Len=0 TSval=1459058321 TSecr=1459058321",""
"2900","26.767311","127.0.0.1","127.0.0.1","TCP","62","60505 > 59876 [PSH, ACK] Seq=185 Ack=268 Win=408032 Len=6 TSval=1459058321 TSecr=1459058321",":137\\r\\n"
"2901","26.767318","127.0.0.1","127.0.0.1","TCP","56","59876 > 60505 [ACK] Seq=268 Ack=191 Win=408096 Len=0 TSval=1459058321 TSecr=1459058321",""
"2902","26.767324","127.0.0.1","127.0.0.1","TCP","195","60505 > 59876 [PSH, ACK] Seq=191 Ack=268 Win=408032 Len=139 TSval=1459058321 TSecr=1459058321","\\r\\n{""seq"":25,""type"":""request"",""command"":""setbreakpoint"",""arguments"":{""line"":20,""column"":0,""type"":""script"",""enabled"":true,""target"":""app.js""}}"
"2903","26.767331","127.0.0.1","127.0.0.1","TCP","56","59876 > 60505 [ACK] Seq=268 Ack=330 Win=407968 Len=0 TSval=1459058321 TSecr=1459058321",""
"2904","26.768651","127.0.0.1","127.0.0.1","TCP","70","60505 > 59876 [PSH, ACK] Seq=330 Ack=268 Win=408032 Len=14 TSval=1459058323 TSecr=1459058321","Content-Length"
"2905","26.768671","127.0.0.1","127.0.0.1","TCP","56","59876 > 60505 [ACK] Seq=268 Ack=344 Win=407936 Len=0 TSval=1459058323 TSecr=1459058323",""
"2906","26.768690","127.0.0.1","127.0.0.1","TCP","57","60505 > 59876 [PSH, ACK] Seq=344 Ack=268 Win=408032 Len=1 TSval=1459058323 TSecr=1459058323",":"
"2907","26.768700","127.0.0.1","127.0.0.1","TCP","56","59876 > 60505 [ACK] Seq=268 Ack=345 Win=407936 Len=0 TSval=1459058323 TSecr=1459058323",""
"2908","26.768722","127.0.0.1","127.0.0.1","TCP","59","60505 > 59876 [PSH, ACK] Seq=345 Ack=268 Win=408032 Len=3 TSval=1459058323 TSecr=1459058323","137"
"2909","26.768737","127.0.0.1","127.0.0.1","TCP","56","59876 > 60505 [ACK] Seq=268 Ack=348 Win=407936 Len=0 TSval=1459058323 TSecr=1459058323",""
"2910","26.768745","127.0.0.1","127.0.0.1","TCP","197","60505 > 59876 [PSH, ACK] Seq=348 Ack=268 Win=408032 Len=141 TSval=1459058323 TSecr=1459058323","\\r\\n\\r\\n{""seq"":26,""type"":""request"",""command"":""setbreakpoint"",""arguments"":{""line"":10,""column"":0,""type"":""script"",""enabled"":true,""target"":""app.js""}}"
"2911","26.768754","127.0.0.1","127.0.0.1","TCP","56","59876 > 60505 [ACK] Seq=268 Ack=489 Win=407808 Len=0 TSval=1459058323 TSecr=1459058323",""
"2912","26.779654","127.0.0.1","127.0.0.1","TCP","78","59876 > 60505 [PSH, ACK] Seq=268 Ack=489 Win=407808 Len=22 TSval=1459058332 TSecr=1459058323","Content-Length: 1982\\r\\n"
"2913","26.779680","127.0.0.1","127.0.0.1","TCP","56","60505 > 59876 [ACK] Seq=489 Ack=290 Win=408000 Len=0 TSval=1459058332 TSecr=1459058332",""
"2914","26.818016","127.0.0.1","127.0.0.1","TCP","2528","59876 > 60505 [PSH, ACK] Seq=290 Ack=489 Win=407808 Len=2472 TSval=1459058370 TSecr=1459058332","\\r\\n{""seq"":1,""request_seq"":24,""type"":""response"",""command"":""backtrace"",""success"":true,""body"":{""fromFrame"":0,""toFrame"":1,""totalFrames"":1,""frames"":[{""type"":""frame"",""index"":0,""receiver"":{""ref"":0,""type"":""function"",""name"":""Module"",""inferredName"":"""",""scriptId"":3"
"2915","26.818065","127.0.0.1","127.0.0.1","TCP","56","60505 > 59876 [ACK] Seq=489 Ack=2762 Win=405536 Len=0 TSval=1459058370 TSecr=1459058370",""
"2916","26.818596","127.0.0.1","127.0.0.1","TCP","70","60505 > 59876 [PSH, ACK] Seq=489 Ack=2762 Win=405536 Len=14 TSval=1459058370 TSecr=1459058370","Content-Length"
"2917","26.818617","127.0.0.1","127.0.0.1","TCP","56","59876 > 60505 [ACK] Seq=2762 Ack=503 Win=407776 Len=0 TSval=1459058370 TSecr=1459058370",""
"2918","26.818626","127.0.0.1","127.0.0.1","TCP","61","60505 > 59876 [PSH, ACK] Seq=503 Ack=2762 Win=405536 Len=5 TSval=1459058370 TSecr=1459058370",":92\\r\\n"
"2919","26.818631","127.0.0.1","127.0.0.1","TCP","56","59876 > 60505 [ACK] Seq=2762 Ack=508 Win=407776 Len=0 TSval=1459058370 TSecr=1459058370",""
"2920","26.818638","127.0.0.1","127.0.0.1","TCP","150","60505 > 59876 [PSH, ACK] Seq=508 Ack=2762 Win=405536 Len=94 TSval=1459058370 TSecr=1459058370","\\r\\n{""seq"":28,""type"":""request"",""command"":""scripts"",""arguments"":{""types"":4,""includeSource"":true}}"
"2921","26.818645","127.0.0.1","127.0.0.1","TCP","56","59876 > 60505 [ACK] Seq=2762 Ack=602 Win=407680 Len=0 TSval=1459058370 TSecr=1459058370",""
"2922","26.829017","127.0.0.1","127.0.0.1","TCP","80","59876 > 60505 [PSH, ACK] Seq=2762 Ack=602 Win=407680 Len=24 TSval=1459058380 TSecr=1459058370","Content-Length: 140010\\r\\n"
"2923","26.829051","127.0.0.1","127.0.0.1","TCP","56","60505 > 59876 [ACK] Seq=602 Ack=2786 Win=405504 Len=0 TSval=1459058380 TSecr=1459058380",""
"2924","26.839240","127.0.0.1","127.0.0.1","TCP","16388","59876 > 60505 [ACK] Seq=2786 Ack=602 Win=407680 Len=16332 TSval=1459058388 TSecr=1459058380","\\r\\n{""seq"":4,""request_seq"":28,""type"":""response"",""command"":""scripts"",""success"":true,""body"":[{""handle"":11,""type"":""script"",""name"":""ti:/bootstrap.js"",""id"":17,""lineOffset"":0,""columnOffset"":0,""lineCount"":1377,""source"":""(function (exports, require, module, __fil"
"2925","26.839248","127.0.0.1","127.0.0.1","TCP","16388","59876 > 60505 [ACK] Seq=19118 Ack=602 Win=407680 Len=16332 TSval=1459058388 TSecr=1459058380","{\\n\\t\\t\\t\\t\\t\\t\\tget: function() {\\n\\t\\t\\t\\t\\t\\t\\t\\treturn lazyGet(this, \\""ti.modules.titanium.android.notificationmanager.BigPictureStyleProxy\\"", \\""BigPictureStyle\\"", \\""Android.BigPictureStyle\\"");\\n\\t\\t\\t\\t\\t\\t\\t},\\n\\t\\t\\t\\t\\t\\t\\tconfigurable: true\\n\\t\\t"
"2926","26.839258","127.0.0.1","127.0.0.1","TCP","16388","59876 > 60505 [ACK] Seq=35450 Ack=602 Win=407680 Len=16332 TSval=1459058388 TSecr=1459058380","is, \\""org.appcelerator.titanium.TiFileProxy\\"", \\""TiFile\\"", \\""TiFile\\"");\\n\\t\\t\\t\\t},\\n\\t\\t\\t\\tconfigurable: true\\n\\t\\t\\t},\\n\\t\\t\\t\\""Gesture\\"": {\\n\\t\\t\\t\\tget: function() {\\n\\t\\t\\t\\t\\treturn lazyGet(this, \\""ti.modules.titanium.gesture.GestureModule\\"", \\""Ges"
"2927","26.839262","127.0.0.1","127.0.0.1","TCP","16388","59876 > 60505 [ACK] Seq=51782 Ack=602 Win=407680 Len=16332 TSval=1459058388 TSecr=1459058380",""", \\""UI.Tab\\"");\\n\\t\\t\\t\\t\\t\\t\\t},\\n\\t\\t\\t\\t\\t\\t\\tconfigurable: true\\n\\t\\t\\t\\t\\t\\t},\\n\\t\\t\\t\\t\\t\\n\\t\\t\\t\\t\\t});\\n\\t\\t\\t\\t\\tUI.constructor.prototype.createActivityIndicator = function() {\\n\\t\\t\\t\\t\\t\\treturn new UI.ActivityIndicator(arguments);\\n\\t\\t\\t\\t\\t}"
"2928","26.839264","127.0.0.1","127.0.0.1","TCP","56","60505 > 59876 [ACK] Seq=602 Ack=35450 Win=372832 Len=0 TSval=1459058388 TSecr=1459058388",""
"2929","26.839266","127.0.0.1","127.0.0.1","TCP","250","59876 > 60505 [PSH, ACK] Seq=68114 Ack=602 Win=407680 Len=194 TSval=1459058388 TSecr=1459058380","tapiNamespace = api;\\n\\t\\trealAPI = realAPI[name];\\n\\t}\\n\\n\\tvar delegate = realAPI[invocationAPI.api];\\n\\n\\t// These invokers form a call hierarchy so we need to\\n\\t// provide a way back to the"
"2930","26.839276","127.0.0.1","127.0.0.1","TCP","56","60505 > 59876 [ACK] Seq=602 Ack=68114 Win=340160 Len=0 TSval=1459058388 TSecr=1459058388",""
"2931","26.839287","127.0.0.1","127.0.0.1","TCP","56","60505 > 59876 [ACK] Seq=602 Ack=68308 Win=339968 Len=0 TSval=1459058388 TSecr=1459058388",""
"2932","26.850014","127.0.0.1","127.0.0.1","TCP","16388","59876 > 60505 [ACK] Seq=68308 Ack=602 Win=407680 Len=16332 TSval=1459058398 TSecr=1459058388"," actual root Titanium / actual impl.\\n\\twhile (delegate.__delegate__) {\\n\\t\\tdelegate = delegate.__delegate__;\\n\\t}\\n\\n\\tapiNamespace[invocationAPI.api] = createInvoker(realAPI, delegate, scopeVars);\\n}\\nexports.genInvoker = genInvoker;\\n\\n/**\\n * Creates"
"2933","26.850020","127.0.0.1","127.0.0.1","TCP","16388","59876 > 60505 [ACK] Seq=84640 Ack=602 Win=407680 Len=16332 TSval=1459058398 TSecr=1459058388","geDirectory;\\n\\t\\t}\\n\\t\\treturn path.join(extStorage, appId, data.pathname);\\n\\n\\t} else if (data.protocol == \\""appdata-private:\\"") {\\n\\t\\tif (!privateAppData) {\\n\\t\\t\\tprivateAppData = Ti.UI.currentWindow.activity.getDir(\\""appdata\\"", 0);\\n\\t\\t}\\n\\t\\tretu"
"2934","26.850022","127.0.0.1","127.0.0.1","TCP","16388","59876 > 60505 [ACK] Seq=100972 Ack=602 Win=407680 Len=16332 TSval=1459058398 TSecr=1459058388","ource);\\n\\n\\tvar f = Script.runInThisContext(source, filename, true);\\n\\treturn f(this.exports, require, this, filename, path.dirname(filename), ti, ti, global, kroll);\\n}\\n\\n// Determine the paths where the requested module could live.\\n// Returns [id, p"
"2935","26.850025","127.0.0.1","127.0.0.1","TCP","16388","59876 > 60505 [ACK] Seq=117304 Ack=602 Win=407680 Len=16332 TSval=1459058398 TSecr=1459058388","ns);\\n\\n\\t\\tif (options) {\\n\\t\\t\\ttabGroup._tabs = options.tabs || [];\\n\\t\\t\\ttabGroup._activeTab = options.activeTab || -1;\\n\\t\\t} else {\\n\\t\\t\\ttabGroup._tabs = [];\\n\\t\\t\\ttabGroup._activeTab = -1;\\n\\t\\t}\\n\\n\\t\\t// Keeps track of the current tab group s"
"2936","26.850032","127.0.0.1","127.0.0.1","TCP","248","59876 > 60505 [PSH, ACK] Seq=133636 Ack=602 Win=407680 Len=192 TSval=1459058398 TSecr=1459058388","\\t\\treturn this;\\n\\t\\t}\\n\\t\\t\\n\\t\\tif (count == 0) {\\n\\t\\t\\tthis._hasListenersForEventType(type, false);\\n\\t\\t}\\n\\n\\t\\treturn this;\\n\\t},\\n\\tenumerable: false\\n});\\n\\nObject.defineProperty(Eve"
"2937","26.850049","127.0.0.1","127.0.0.1","TCP","56","60505 > 59876 [ACK] Seq=602 Ack=100972 Win=307328 Len=0 TSval=1459058398 TSecr=1459058398",""
"2938","26.850054","127.0.0.1","127.0.0.1","TCP","56","60505 > 59876 [ACK] Seq=602 Ack=133636 Win=274656 Len=0 TSval=1459058398 TSecr=1459058398",""
"2939","26.850058","127.0.0.1","127.0.0.1","TCP","56","60505 > 59876 [ACK] Seq=602 Ack=133828 Win=274464 Len=0 TSval=1459058398 TSecr=1459058398",""
"2940","26.876245","127.0.0.1","127.0.0.1","TCP","9026","59876 > 60505 [PSH, ACK] Seq=133828 Ack=602 Win=407680 Len=8970 TSval=1459058421 TSecr=1459058398","ntEmitter.prototype, \\""removeEventListener\\"", {\\n\\tvalue: EventEmitter.prototype.removeListener,\\n\\tenumerable: false,\\n\\twritable: true\\n});\\n\\nObject.defineProperty(EventEmitter.prototype, \\""removeAllListeners\\"", {\\n\\tvalue: function(type) {\\n\\t\\t// doe"
"2941","26.876275","127.0.0.1","127.0.0.1","TCP","56","60505 > 59876 [ACK] Seq=602 Ack=142798 Win=265472 Len=0 TSval=1459058421 TSecr=1459058421",""
"2942","26.880842","127.0.0.1","127.0.0.1","TCP","70","60505 > 59876 [PSH, ACK] Seq=602 Ack=142798 Win=265472 Len=14 TSval=1459058425 TSecr=1459058421","Content-Length"
"2943","26.880888","127.0.0.1","127.0.0.1","TCP","56","59876 > 60505 [ACK] Seq=142798 Ack=616 Win=407680 Len=0 TSval=1459058425 TSecr=1459058425",""
"2944","26.881113","127.0.0.1","127.0.0.1","TCP","57","60505 > 59876 [PSH, ACK] Seq=616 Ack=142798 Win=265472 Len=1 TSval=1459058425 TSecr=1459058425",":"
"2945","26.881149","127.0.0.1","127.0.0.1","TCP","56","59876 > 60505 [ACK] Seq=142798 Ack=617 Win=407680 Len=0 TSval=1459058425 TSecr=1459058425",""
"2946","26.881163","127.0.0.1","127.0.0.1","TCP","110","60505 > 59876 [PSH, ACK] Seq=617 Ack=142798 Win=265472 Len=54 TSval=1459058425 TSecr=1459058425","48\\r\\n\\r\\n{""seq"":29,""type"":""request"",""command"":""continue""}"
"2947","26.881170","127.0.0.1","127.0.0.1","TCP","56","59876 > 60505 [ACK] Seq=142798 Ack=671 Win=407616 Len=0 TSval=1459058425 TSecr=1459058425",""
"2948","26.891659","127.0.0.1","127.0.0.1","TCP","76","59876 > 60505 [PSH, ACK] Seq=142798 Ack=671 Win=407616 Len=20 TSval=1459058435 TSecr=1459058425","Content-Length: 95\\r\\n"
"2949","26.891681","127.0.0.1","127.0.0.1","TCP","56","60505 > 59876 [ACK] Seq=671 Ack=142818 Win=265472 Len=0 TSval=1459058435 TSecr=1459058435",""
"2950","26.927671","127.0.0.1","127.0.0.1","TCP","936","59876 > 60505 [PSH, ACK] Seq=142818 Ack=671 Win=407616 Len=880 TSval=1459058471 TSecr=1459058435","\\r\\n{""seq"":5,""request_seq"":29,""type"":""response"",""command"":""continue"",""success"":true,""running"":true}Content-Length: 462\\r\\n\\r\\n{""seq"":6,""type"":""event"",""event"":""afterCompile"",""success"":true,""body"":{""script"":{""handle"":1,""type"":""script"",""name"":""app.js"",""id"":3"
"2951","26.927703","127.0.0.1","127.0.0.1","TCP","56","60505 > 59876 [ACK] Seq=671 Ack=143698 Win=264576 Len=0 TSval=1459058471 TSecr=1459058471",""
"2952","26.928310","127.0.0.1","127.0.0.1","TCP","70","60505 > 59876 [PSH, ACK] Seq=671 Ack=143698 Win=264576 Len=14 TSval=1459058471 TSecr=1459058471","Content-Length"
"2953","26.928365","127.0.0.1","127.0.0.1","TCP","56","59876 > 60505 [ACK] Seq=143698 Ack=685 Win=407616 Len=0 TSval=1459058471 TSecr=1459058471",""
"2954","26.928377","127.0.0.1","127.0.0.1","TCP","156","60505 > 59876 [PSH, ACK] Seq=685 Ack=143698 Win=264576 Len=100 TSval=1459058471 TSecr=1459058471",":93\\r\\n\\r\\n{""seq"":30,""type"":""request"",""command"":""scripts"",""arguments"":{""includeSource"":true,""ids"":[37]}}"
"2955","26.928385","127.0.0.1","127.0.0.1","TCP","56","59876 > 60505 [ACK] Seq=143698 Ack=785 Win=407488 Len=0 TSval=1459058471 TSecr=1459058471",""
"2956","26.928396","127.0.0.1","127.0.0.1","TCP","71","60505 > 59876 [PSH, ACK] Seq=785 Ack=143698 Win=264576 Len=15 TSval=1459058471 TSecr=1459058471","Content-Length:"
"2957","26.928403","127.0.0.1","127.0.0.1","TCP","56","59876 > 60505 [ACK] Seq=143698 Ack=800 Win=407488 Len=0 TSval=1459058471 TSecr=1459058471",""
"2958","26.928410","127.0.0.1","127.0.0.1","TCP","143","60505 > 59876 [PSH, ACK] Seq=800 Ack=143698 Win=264576 Len=87 TSval=1459058471 TSecr=1459058471","81\\r\\n\\r\\n{""seq"":31,""type"":""request"",""command"":""backtrace"",""arguments"":{""inlineRefs"":true}}"
"2959","26.928414","127.0.0.1","127.0.0.1","TCP","56","59876 > 60505 [ACK] Seq=143698 Ack=887 Win=407392 Len=0 TSval=1459058471 TSecr=1459058471",""
"2960","26.935409","127.0.0.1","127.0.0.1","TCP","78","59876 > 60505 [PSH, ACK] Seq=143698 Ack=887 Win=407392 Len=22 TSval=1459058478 TSecr=1459058471","Content-Length: 2843\\r\\n"
"2961","26.935426","127.0.0.1","127.0.0.1","TCP","56","60505 > 59876 [ACK] Seq=887 Ack=143720 Win=264576 Len=0 TSval=1459058478 TSecr=1459058478",""
"2962","26.975658","127.0.0.1","127.0.0.1","TCP","7984","59876 > 60505 [PSH, ACK] Seq=143720 Ack=887 Win=407392 Len=7928 TSval=1459058517 TSecr=1459058478","\\r\\n{""seq"":8,""request_seq"":30,""type"":""response"",""command"":""scripts"",""success"":true,""body"":[{""handle"":7,""type"":""script"",""name"":""app.js"",""id"":37,""lineOffset"":0,""columnOffset"":0,""lineCount"":101,""source"":""// this sets the background color of the master UIView"
"2963","26.975683","127.0.0.1","127.0.0.1","TCP","56","60505 > 59876 [ACK] Seq=887 Ack=151648 Win=517952 Len=0 TSval=1459058517 TSecr=1459058517",""
"4284","64.058079","127.0.0.1","127.0.0.1","TCP","70","60505 > 59876 [PSH, ACK] Seq=887 Ack=151648 Win=517952 Len=14 TSval=1459095461 TSecr=1459058517","Content-Length"
"4285","64.058116","127.0.0.1","127.0.0.1","TCP","56","59876 > 60505 [ACK] Seq=151648 Ack=901 Win=407392 Len=0 TSval=1459095461 TSecr=1459095461",""
"4286","64.058131","127.0.0.1","127.0.0.1","TCP","61","60505 > 59876 [PSH, ACK] Seq=901 Ack=151648 Win=517952 Len=5 TSval=1459095461 TSecr=1459095461",":84\\r\\n"
"4287","64.058140","127.0.0.1","127.0.0.1","TCP","56","59876 > 60505 [ACK] Seq=151648 Ack=906 Win=407392 Len=0 TSval=1459095461 TSecr=1459095461",""
"4288","64.058153","127.0.0.1","127.0.0.1","TCP","142","60505 > 59876 [PSH, ACK] Seq=906 Ack=151648 Win=517952 Len=86 TSval=1459095461 TSecr=1459095461","\\r\\n{""seq"":33,""type"":""request"",""command"":""clearbreakpoint"",""arguments"":{""breakpoint"":2}}"
"4289","64.058166","127.0.0.1","127.0.0.1","TCP","56","59876 > 60505 [ACK] Seq=151648 Ack=992 Win=407296 Len=0 TSval=1459095461 TSecr=1459095461",""
"4290","64.063802","127.0.0.1","127.0.0.1","TCP","217","59876 > 60505 [PSH, ACK] Seq=151648 Ack=992 Win=407296 Len=161 TSval=1459095466 TSecr=1459095461","Content-Length: 138\\r\\n\\r\\n{""seq"":10,""request_seq"":33,""type"":""response"",""command"":""clearbreakpoint"",""success"":true,""body"":{""breakpoint"":2},""refs"":[],""running"":false}"
"4291","64.063837","127.0.0.1","127.0.0.1","TCP","56","60505 > 59876 [ACK] Seq=992 Ack=151809 Win=517792 Len=0 TSval=1459095466 TSecr=1459095466",""
"4324","65.224758","127.0.0.1","127.0.0.1","TCP","70","60505 > 59876 [PSH, ACK] Seq=992 Ack=151809 Win=517792 Len=14 TSval=1459096623 TSecr=1459095466","Content-Length"
"4325","65.224787","127.0.0.1","127.0.0.1","TCP","56","59876 > 60505 [ACK] Seq=151809 Ack=1006 Win=407264 Len=0 TSval=1459096623 TSecr=1459096623",""
"4326","65.224799","127.0.0.1","127.0.0.1","TCP","201","60505 > 59876 [PSH, ACK] Seq=1006 Ack=151809 Win=517792 Len=145 TSval=1459096623 TSecr=1459096623",":137\\r\\n\\r\\n{""seq"":34,""type"":""request"",""command"":""setbreakpoint"",""arguments"":{""line"":10,""column"":0,""type"":""script"",""enabled"":true,""target"":""app.js""}}"
"4327","65.224809","127.0.0.1","127.0.0.1","TCP","56","59876 > 60505 [ACK] Seq=151809 Ack=1151 Win=407136 Len=0 TSval=1459096623 TSecr=1459096623",""
"4328","65.234836","127.0.0.1","127.0.0.1","TCP","77","59876 > 60505 [PSH, ACK] Seq=151809 Ack=1151 Win=407136 Len=21 TSval=1459096632 TSecr=1459096623","Content-Length: 259\\r\\n"
"4329","65.234870","127.0.0.1","127.0.0.1","TCP","56","60505 > 59876 [ACK] Seq=1151 Ack=151830 Win=517760 Len=0 TSval=1459096632 TSecr=1459096632",""
"4330","65.237990","127.0.0.1","127.0.0.1","TCP","317","59876 > 60505 [PSH, ACK] Seq=151830 Ack=1151 Win=407136 Len=261 TSval=1459096635 TSecr=1459096632","\\r\\n{""seq"":11,""request_seq"":34,""type"":""response"",""command"":""setbreakpoint"",""success"":true,""body"":{""type"":""scriptName"",""breakpoint"":3,""script_name"":""app.js"",""line"":10,""column"":0,""actual_locations"":[{""line"":10,""column"":0,""script_id"":37}]},""refs"":[],""running"
"4331","65.238020","127.0.0.1","127.0.0.1","TCP","56","60505 > 59876 [ACK] Seq=1151 Ack=152091 Win=517504 Len=0 TSval=1459096635 TSecr=1459096635",""
"4364","66.072530","127.0.0.1","127.0.0.1","TCP","70","60505 > 59876 [PSH, ACK] Seq=1151 Ack=152091 Win=517504 Len=14 TSval=1459097467 TSecr=1459096635","Content-Length"
"4365","66.072570","127.0.0.1","127.0.0.1","TCP","56","59876 > 60505 [ACK] Seq=152091 Ack=1165 Win=407136 Len=0 TSval=1459097467 TSecr=1459097467",""
"4366","66.072589","127.0.0.1","127.0.0.1","TCP","57","60505 > 59876 [PSH, ACK] Seq=1165 Ack=152091 Win=517504 Len=1 TSval=1459097467 TSecr=1459097467",":"
"4367","66.072610","127.0.0.1","127.0.0.1","TCP","56","59876 > 60505 [ACK] Seq=152091 Ack=1166 Win=407104 Len=0 TSval=1459097467 TSecr=1459097467",""
"4368","66.072623","127.0.0.1","127.0.0.1","TCP","146","60505 > 59876 [PSH, ACK] Seq=1166 Ack=152091 Win=517504 Len=90 TSval=1459097467 TSecr=1459097467","84\\r\\n\\r\\n{""seq"":35,""type"":""request"",""command"":""clearbreakpoint"",""arguments"":{""breakpoint"":3}}"
"4369","66.072632","127.0.0.1","127.0.0.1","TCP","56","59876 > 60505 [ACK] Seq=152091 Ack=1256 Win=407040 Len=0 TSval=1459097467 TSecr=1459097467",""
"4370","66.080820","127.0.0.1","127.0.0.1","TCP","77","59876 > 60505 [PSH, ACK] Seq=152091 Ack=1256 Win=407040 Len=21 TSval=1459097474 TSecr=1459097467","Content-Length: 138\\r\\n"
"4371","66.080857","127.0.0.1","127.0.0.1","TCP","56","60505 > 59876 [ACK] Seq=1256 Ack=152112 Win=517472 Len=0 TSval=1459097474 TSecr=1459097474",""
"4372","66.086434","127.0.0.1","127.0.0.1","TCP","196","59876 > 60505 [PSH, ACK] Seq=152112 Ack=1256 Win=407040 Len=140 TSval=1459097478 TSecr=1459097474","\\r\\n{""seq"":12,""request_seq"":35,""type"":""response"",""command"":""clearbreakpoint"",""success"":true,""body"":{""breakpoint"":3},""refs"":[],""running"":false}"
"4373","66.086453","127.0.0.1","127.0.0.1","TCP","56","60505 > 59876 [ACK] Seq=1256 Ack=152252 Win=517344 Len=0 TSval=1459097478 TSecr=1459097478",""
"4374","66.818700","127.0.0.1","127.0.0.1","TCP","70","60505 > 59876 [PSH, ACK] Seq=1256 Ack=152252 Win=517344 Len=14 TSval=1459098209 TSecr=1459097478","Content-Length"
"4375","66.818755","127.0.0.1","127.0.0.1","TCP","56","59876 > 60505 [ACK] Seq=152252 Ack=1270 Win=407008 Len=0 TSval=1459098209 TSecr=1459098209",""
"4376","66.818778","127.0.0.1","127.0.0.1","TCP","201","60505 > 59876 [PSH, ACK] Seq=1270 Ack=152252 Win=517344 Len=145 TSval=1459098209 TSecr=1459098209",":137\\r\\n\\r\\n{""seq"":36,""type"":""request"",""command"":""setbreakpoint"",""arguments"":{""line"":10,""column"":0,""type"":""script"",""enabled"":true,""target"":""app.js""}}"
"4377","66.818798","127.0.0.1","127.0.0.1","TCP","56","59876 > 60505 [ACK] Seq=152252 Ack=1415 Win=406880 Len=0 TSval=1459098209 TSecr=1459098209",""
"4378","66.830217","127.0.0.1","127.0.0.1","TCP","77","59876 > 60505 [PSH, ACK] Seq=152252 Ack=1415 Win=406880 Len=21 TSval=1459098219 TSecr=1459098209","Content-Length: 259\\r\\n"
"4379","66.830259","127.0.0.1","127.0.0.1","TCP","56","60505 > 59876 [ACK] Seq=1415 Ack=152273 Win=517312 Len=0 TSval=1459098219 TSecr=1459098219",""
"4380","66.834491","127.0.0.1","127.0.0.1","TCP","317","59876 > 60505 [PSH, ACK] Seq=152273 Ack=1415 Win=406880 Len=261 TSval=1459098223 TSecr=1459098219","\\r\\n{""seq"":13,""request_seq"":36,""type"":""response"",""command"":""setbreakpoint"",""success"":true,""body"":{""type"":""scriptName"",""breakpoint"":4,""script_name"":""app.js"",""line"":10,""column"":0,""actual_locations"":[{""line"":10,""column"":0,""script_id"":37}]},""refs"":[],""running"
"4381","66.834559","127.0.0.1","127.0.0.1","TCP","56","60505 > 59876 [ACK] Seq=1415 Ack=152534 Win=517056 Len=0 TSval=1459098223 TSecr=1459098223",""
"4545","70.938456","127.0.0.1","127.0.0.1","TCP","70","60505 > 59876 [PSH, ACK] Seq=1415 Ack=152534 Win=517056 Len=14 TSval=1459102313 TSecr=1459098223","Content-Length"
"4546","70.938489","127.0.0.1","127.0.0.1","TCP","56","59876 > 60505 [ACK] Seq=152534 Ack=1429 Win=406848 Len=0 TSval=1459102313 TSecr=1459102313",""
"4547","70.938504","127.0.0.1","127.0.0.1","TCP","60","60505 > 59876 [PSH, ACK] Seq=1429 Ack=152534 Win=517056 Len=4 TSval=1459102313 TSecr=1459102313",":137"
"4548","70.938513","127.0.0.1","127.0.0.1","TCP","56","59876 > 60505 [ACK] Seq=152534 Ack=1433 Win=406848 Len=0 TSval=1459102313 TSecr=1459102313",""
"4549","70.938526","127.0.0.1","127.0.0.1","TCP","197","60505 > 59876 [PSH, ACK] Seq=1433 Ack=152534 Win=517056 Len=141 TSval=1459102313 TSecr=1459102313","\\r\\n\\r\\n{""seq"":37,""type"":""request"",""command"":""setbreakpoint"",""arguments"":{""line"":14,""column"":0,""type"":""script"",""enabled"":true,""target"":""app.js""}}"
"4550","70.938534","127.0.0.1","127.0.0.1","TCP","56","59876 > 60505 [ACK] Seq=152534 Ack=1574 Win=406720 Len=0 TSval=1459102313 TSecr=1459102313",""
"4551","70.949874","127.0.0.1","127.0.0.1","TCP","77","59876 > 60505 [PSH, ACK] Seq=152534 Ack=1574 Win=406720 Len=21 TSval=1459102322 TSecr=1459102313","Content-Length: 259\\r\\n"
"4552","70.949901","127.0.0.1","127.0.0.1","TCP","56","60505 > 59876 [ACK] Seq=1574 Ack=152555 Win=517056 Len=0 TSval=1459102322 TSecr=1459102322",""
"4553","70.953656","127.0.0.1","127.0.0.1","TCP","317","59876 > 60505 [PSH, ACK] Seq=152555 Ack=1574 Win=406720 Len=261 TSval=1459102326 TSecr=1459102322","\\r\\n{""seq"":14,""request_seq"":37,""type"":""response"",""command"":""setbreakpoint"",""success"":true,""body"":{""type"":""scriptName"",""breakpoint"":5,""script_name"":""app.js"",""line"":14,""column"":0,""actual_locations"":[{""line"":14,""column"":0,""script_id"":37}]},""refs"":[],""running"
"4554","70.953682","127.0.0.1","127.0.0.1","TCP","56","60505 > 59876 [ACK] Seq=1574 Ack=152816 Win=516768 Len=0 TSval=1459102326 TSecr=1459102326",""
"4587","72.861595","127.0.0.1","127.0.0.1","TCP","70","60505 > 59876 [PSH, ACK] Seq=1574 Ack=152816 Win=516768 Len=14 TSval=1459104225 TSecr=1459102326","Content-Length"
"4588","72.861629","127.0.0.1","127.0.0.1","TCP","56","59876 > 60505 [ACK] Seq=152816 Ack=1588 Win=406688 Len=0 TSval=1459104225 TSecr=1459104225",""
"4589","72.861649","127.0.0.1","127.0.0.1","TCP","147","60505 > 59876 [PSH, ACK] Seq=1588 Ack=152816 Win=516768 Len=91 TSval=1459104225 TSecr=1459104225",":84\\r\\n\\r\\n{""seq"":38,""type"":""request"",""command"":""clearbreakpoint"",""arguments"":{""breakpoint"":5}}"
"4590","72.861657","127.0.0.1","127.0.0.1","TCP","56","59876 > 60505 [ACK] Seq=152816 Ack=1679 Win=406592 Len=0 TSval=1459104225 TSecr=1459104225",""
"4591","72.865265","127.0.0.1","127.0.0.1","TCP","217","59876 > 60505 [PSH, ACK] Seq=152816 Ack=1679 Win=406592 Len=161 TSval=1459104228 TSecr=1459104225","Content-Length: 138\\r\\n\\r\\n{""seq"":15,""request_seq"":38,""type"":""response"",""command"":""clearbreakpoint"",""success"":true,""body"":{""breakpoint"":5},""refs"":[],""running"":false}"
"4592","72.865288","127.0.0.1","127.0.0.1","TCP","56","60505 > 59876 [ACK] Seq=1679 Ack=152977 Win=516608 Len=0 TSval=1459104228 TSecr=1459104228",""
"4657","74.228747","127.0.0.1","127.0.0.1","TCP","70","60505 > 59876 [PSH, ACK] Seq=1679 Ack=152977 Win=516608 Len=14 TSval=1459105584 TSecr=1459104228","Content-Length"
"4658","74.228780","127.0.0.1","127.0.0.1","TCP","56","59876 > 60505 [ACK] Seq=152977 Ack=1693 Win=406592 Len=0 TSval=1459105584 TSecr=1459105584",""
"4659","74.228797","127.0.0.1","127.0.0.1","TCP","60","60505 > 59876 [PSH, ACK] Seq=1693 Ack=152977 Win=516608 Len=4 TSval=1459105584 TSecr=1459105584",":150"
"4660","74.228803","127.0.0.1","127.0.0.1","TCP","56","59876 > 60505 [ACK] Seq=152977 Ack=1697 Win=406592 Len=0 TSval=1459105584 TSecr=1459105584",""
"4661","74.228810","127.0.0.1","127.0.0.1","TCP","210","60505 > 59876 [PSH, ACK] Seq=1697 Ack=152977 Win=516608 Len=154 TSval=1459105584 TSecr=1459105584","\\r\\n\\r\\n{""seq"":39,""type"":""request"",""command"":""evaluate"",""arguments"":{""disable_break"":true,""expression"":""Ti.API.terminate();"",""inlineRefs"":true,""global"":true}}"
"4662","74.228820","127.0.0.1","127.0.0.1","TCP","56","59876 > 60505 [ACK] Seq=152977 Ack=1851 Win=406432 Len=0 TSval=1459105584 TSecr=1459105584",""
"4663","74.234336","127.0.0.1","127.0.0.1","TCP","56","59876 > 60505 [FIN, ACK] Seq=152977 Ack=1851 Win=406432 Len=0 TSval=1459105589 TSecr=1459105584",""
"4664","74.234367","127.0.0.1","127.0.0.1","TCP","56","60505 > 59876 [ACK] Seq=1851 Ack=152978 Win=516608 Len=0 TSval=1459105589 TSecr=1459105589",""
"4665","74.237847","127.0.0.1","127.0.0.1","TCP","56","60505 > 59876 [FIN, ACK] Seq=1851 Ack=152978 Win=516608 Len=0 TSval=1459105592 TSecr=1459105589",""
"4666","74.237894","127.0.0.1","127.0.0.1","TCP","56","59876 > 60505 [ACK] Seq=152978 Ack=1852 Win=406432 Len=0 TSval=1459105592 TSecr=1459105592",""
